submission_id,title,score,num_comments,title_length,subreddit,post_text,comment_karma,link_karma,upvote_ratio,date_created,user_name,appearance,text_changed,num_words_title,post_length,num_words_post,num_distinct_words,trigrams,AllPunc,Apostro,Colon,Comma,Dash,Exclam,OtherP,Parenth,Period,QMark,Quote,SemiC,achieve,adj,adverb,affect,affiliation,anger,anx,article,assent,auxverb,bio,body,cause,certain,cogproc,compare,conj,death,differ,discrep,drives,family,feel,female,filler,focusfuture,focuspast,focuspresent,friend,function,health,hear,home,i,informal,ingest,insight,interrog,ipron,leisure,male,money,motion,negate,negemo,netspeak,nonflu,number,percept,posemo,power,ppron,prep,pronoun,quant,relativ,relig,reward,risk,sad,see,sexual,shehe,social,space,swear,tentat,they,time,verb,we,work,you,is_depressed
8bxl3z,cylsie,8.0,0.0,6.0,worldbuilding,used to be a young technician  cylsie has become a unique being when she accidentally ended a civilization her age was higly advanced in both magic and technology  using magitech  they built a machine that wouldve given them infinite energy  and wouldve allowed them to advance even further at the core of the machine  there shouldve been a very precisely manufactured eldritch crystal  filled with all potential magic could give  the rest of the machine was to convert  realign  and distribute its energy in a useful form cylsie was a young technician working on the machine  she had a though to be broken  empty eldritch crystal  as a medal on her necklace  one day  out of curiosity  she placed the crystal into the machine  and it overloaded  and exploded  levelling her ages civilization  sending them back to the stone age as she lay in the rubble  she was surprised that she found herself unharmed  and feeling even a bit better than ever before  before her eyes  a man appeared from thin air  claiming to be one of the nex  the ruling class gods of the world  he was called yaldr he told her that her civilization was destroyed  and that it was her fault  he also told her that the energy surge she had caused was enough to half create a new nex  but since it couldnt form completely  its essence attached itself to cylsie  protecting her from the explosion  and fusing her soul with a nexs left with no other choice  cylsie joined yaldr  and he taught her all about the nex  in turn  she taught him all she new about mortals  and most importantly  how emotions work  theyre too mundane for a nex to comprehend them  but with cylsies help  yaldr could access them  the newfound ability amazed yaldr  he never thought something like this coukd exist  and was marveling in these emotions  he was not properly warned about the negatives  and their depths terrified him  hes decoded not to fully access them anymore time has passed  ages came and went  civilizations rose and fell  great things came to be  then were destroyed  and cylsie endured  a quadrillion years later  shes now the oldest being born in the mortal realm  and possibly the only one like herself ,8188.0,10435.0,0.91,2018-04-13 11:19:22,TheMomentofGallifrey,0.0,0.0,1.0,2195.0,378.0,225,"__u _us use sed __t _to __b _be __a __y _yo you oun ung __t _te tec ech chn hni nic ici cia ian an, __c _cy cyl yls lsi sie __h _ha has __b _be bec eco com ome __a __u _un uni niq iqu que __b _be bei ein ing __w _wh whe hen __s _sh she __a _ac acc cci cid ide den ent nta tal all lly __e _en end nde ded __a __c _ci civ ivi vil ili liz iza zat ati tio ion on. n.h .he her __a _ag age __w _wa was __h _hi hig igl gly __a _ad adv dva van anc nce ced __i _in __b _bo bot oth __m _ma mag agi gic __a _an and __t _te tec ech chn hno nol olo log ogy gy. __u _us usi sin ing __m _ma mag agi git ite tec ech ch, __t _th the hey __b _bu bui uil ilt __a __m _ma mac ach chi hin ine __t _th tha hat __w _wo wou oul uld ldv dve __g _gi giv ive ven __t _th the hem __i _in inf nfi fin ini nit ite __e _en ene ner erg rgy gy, __a _an and __w _wo wou oul uld ldv dve __a _al all llo low owe wed __t _th the hem __t _to __a _ad adv dva van anc nce __e _ev eve ven __f _fu fur urt rth the her er. r.a .at __t _th the __c _co cor ore __o _of __t _th the __m _ma mac ach chi hin ine ne, __t _th the her ere __s _sh sho hou oul uld ldv dve __b _be bee een __a __v _ve ver ery __p _pr pre rec eci cis ise sel ely __m _ma man anu nuf ufa fac act ctu tur ure red __e _el eld ldr dri rit itc tch __c _cr cry rys yst sta tal al, __f _fi fil ill lle led __w _wi wit ith __a _al all __p _po pot ote ten ent nti tia ial __m _ma mag agi gic __c _co cou oul uld __g _gi giv ive ve. __t _th the __r _re res est __o _of __t _th the __m _ma mac ach chi hin ine __w _wa was __t _to __c _co con onv nve ver ert rt, __r _re rea eal ali lig ign gn, __a _an and __d _di dis ist str tri rib ibu but ute __i _it its __e _en ene ner erg rgy __i _in __a __u _us use sef efu ful __f _fo for orm rm. m.c .cy cyl yls lsi sie __w _wa was __a __y _yo you oun ung __t _te tec ech chn hni nic ici cia ian __w _wo wor ork rki kin ing __o _on __t _th the __m _ma mac ach chi hin ine ne. __s _sh she __h _ha had __a __t _th tho hou oug ugh __t _to __b _be __b _br bro rok oke ken en, __e _em emp mpt pty __e _el eld ldr dri rit itc tch __c _cr cry rys yst sta tal al, __a _as __a __m _me med eda dal __o _on __h _he her __n _ne nec eck ckl kla lac ace ce. __o _on one __d _da day ay, __o _ou out __o _of __c _cu cur uri rio ios osi sit ity ty, __s _sh she __p _pl pla lac ace ced __t _th the __c _cr cry rys yst sta tal __i _in int nto __t _th the __m _ma mac ach chi hin ine ne, __a _an and __i _it __o _ov ove ver erl rlo loa oad ade ded ed, __a _an and __e _ex exp xpl plo lod ode ded ed, __l _le lev eve vel ell lli lin ing __h _he her __a _ag age ges __c _ci civ ivi vil ili liz iza zat ati tio ion on, __s _se sen end ndi din ing __t _th the hem __b _ba bac ack __t _to __t _th the __s _st sto ton one __a _ag age ge. e.a .as __s _sh she __l _la lay __i _in __t _th the __r _ru rub ubb bbl ble le, __s _sh she __w _wa was __s _su sur urp rpr pri ris ise sed __t _th tha hat __s _sh she __f _fo fou oun und __h _he her ers rse sel elf __u _un unh nha har arm rme med ed, __a _an and __f _fe fee eel eli lin ing __e _ev eve ven __a __b _bi bit __b _be bet ett tte ter __t _th tha han __e _ev eve ver __b _be bef efo for ore re. __b _be bef efo for ore __h _he her __e _ey eye yes es, __a __m _ma man __a _ap app ppe pea ear are red __f _fr fro rom __t _th thi hin __a _ai air ir, __c _cl cla lai aim imi min ing __t _to __b _be __o _on one __o _of __t _th the __n _ne nex ex, __t _th the __r _ru rul uli lin ing __c _cl cla las ass __g _go god ods __o _of __t _th the __w _wo wor orl rld ld. __h _he __w _wa was __c _ca cal all lle led __y _ya yal ald ldr dr. r.h .he __t _to tol old __h _he her __t _th tha hat __h _he her __c _ci civ ivi vil ili liz iza zat ati tio ion __w _wa was __d _de des est str tro roy oye yed ed, __a _an and __t _th tha hat __i _it __w _wa was __h _he her __f _fa fau aul ult lt. __h _he __a _al als lso __t _to tol old __h _he her __t _th tha hat __t _th the __e _en ene ner erg rgy __s _su sur urg rge __s _sh she __h _ha had __c _ca cau aus use sed __w _wa was __e _en eno nou oug ugh __t _to __h _ha hal alf lf- f-c -cr cre rea eat ate __a __n _ne new __n _ne nex ex, __b _bu but __s _si sin inc nce __i _it __c _co cou oul uld ldn dnt __f _fo for orm __c _co com omp mpl ple let ete tel ely ly, __i _it its __e _es ess sse sen enc nce __a _at att tta tac ach che hed __i _it its tse sel elf __t _to __c _cy cyl yls lsi sie ie, __p _pr pro rot ote tec ect cti tin ing __h _he her __f _fr fro rom __t _th the __e _ex exp xpl plo los osi sio ion on, __a _an and __f _fu fus usi sin ing __h _he her __s _so sou oul __w _wi wit ith __a __n _ne nex exs xs. s.l .le lef eft __w _wi wit ith __n _no __o _ot oth the her __c _ch cho hoi oic ice ce, __c _cy cyl yls lsi sie __j _jo joi oin ine ned __y _ya yal ald ldr dr, __a _an and __h _he __t _ta tau aug ugh ght __h _he her __a _al all __a _ab abo bou out __t _th the __n _ne nex ex. __i _in __t _tu tur urn rn, __s _sh she __t _ta tau aug ugh ght __h _hi him __a _al all __s _sh she __n _ne new __a _ab abo bou out __m _mo mor ort rta tal als ls, __a _an and __m _mo mos ost __i _im imp mpo por ort rta tan ant ntl tly ly, __h _ho how __e _em emo mot oti tio ion ons __w _wo wor ork rk. __t _th the hey eyr yre __t _to too __m _mu mun und nda dan ane __f _fo for __a __n _ne nex __t _to __c _co com omp mpr pre reh ehe hen end __t _th the hem em, __b _bu but __w _wi wit ith __c _cy cyl yls lsi sie ies __h _he hel elp lp, __y _ya yal ald ldr __c _co cou oul uld __a _ac acc cce ces ess __t _th the hem em. __t _th the __n _ne new ewf wfo fou oun und __a _ab abi bil ili lit ity __a _am ama maz aze zed __y _ya yal ald ldr dr. __h _he __n _ne nev eve ver __t _th tho hou oug ugh ght __s _so som ome met eth thi hin ing __l _li lik ike __t _th thi his __c _co cou ouk ukd __e _ex exi xis ist st, __a _an and __w _wa was __m _ma mar arv rve vel eli lin ing __i _in __t _th the hes ese __e _em emo mot oti tio ion ons ns. __h _he __w _wa was __n _no not __p _pr pro rop ope per erl rly __w _wa war arn rne ned __a _ab abo bou out __t _th the __n _ne neg ega gat ati tiv ive ves es, __a _an and __t _th the hei eir __d _de dep ept pth ths __t _te ter err rri rif ifi fie ied __h _hi him im. __h _he hes __d _de dec eco cod ode ded __n _no not __t _to __f _fu ful ull lly __a _ac acc cce ces ess __t _th the hem __a _an any nym ymo mor ore re. e.t .ti tim ime __h _ha has __p _pa pas ass sse sed ed, __a _ag age ges __c _ca cam ame __a _an and __w _we wen ent nt, __c _ci civ ivi vil ili liz iza zat ati tio ion ons __r _ro ros ose __a _an and __f _fe fel ell ll, __g _gr gre rea eat __t _th thi hin ing ngs __c _ca cam ame __t _to __b _be be, __t _th the hen __w _we wer ere __d _de des est str tro roy oye yed ed, __a _an and __c _cy cyl yls lsi sie __e _en end ndu dur ure red ed. __a __q _qu qua uad adr dri ril ill lli lio ion __y _ye yea ear ars __l _la lat ate ter er, __s _sh she hes __n _no now __t _th the __o _ol old lde des est __b _be bei ein ing __b _bo bor orn __i _in __t _th the __m _mo mor ort rta tal __r _re rea eal alm lm, __a _an and __p _po pos oss ssi sib ibl bly __t _th the __o _on onl nly __o _on one __l _li lik ike __h _he her ers rse sel elf lf.",0.15853658,0.0,0.0,0.06097561,0.0,0.0,0.0,0.0,0.07317073,0.024390243,0.0,0.0,0.0121951215,0.10975610000000001,0.14634146,0.06097561,0.0121951215,0.0,0.0,0.0121951215,0.0,0.13414635,0.0,0.0,0.0121951215,0.048780486,0.20731707,0.07317073,0.07317073,0.0,0.048780486,0.036585364,0.036585364,0.0121951215,0.036585364,0.0,0.0,0.0,0.0121951215,0.21951220000000002,0.0,0.6097561,0.0,0.0121951215,0.0121951215,0.10975610000000001,0.0,0.0,0.048780486,0.06097561,0.024390243,0.0121951215,0.0,0.0,0.0121951215,0.024390243,0.048780486,0.0,0.0,0.048780486,0.06097561,0.0121951215,0.0121951215,0.13414635,0.14634146,0.15853658,0.06097561,0.15853658,0.0,0.0121951215,0.0,0.048780486,0.0121951215,0.0,0.0,0.085365854,0.048780486,0.0,0.024390243,0.0,0.09756097,0.23170732,0.0,0.0,0.024390243,1
5huqks,how much to buy all pathfinder products?,6.0,11.0,40.0,Pathfinder_RPG,i know its probably near impossible to know exactly but im curious what everyones best guess would be for how much money itd take to buy all that pathfinder books  im mainly talking about any books that come in hardback but also boxes and adventures  im just curious if someone were rich how much they would have to spend too get a vast pathfinder library lolthanks ,350.0,205.0,0.73,2016-12-12 06:50:08,Xenopulp,0.0,0.0,7.0,376.0,67.0,54,__i __k _kn kno now __i _it its __p _pr pro rob oba bab abl bly __n _ne nea ear __i _im imp mpo pos oss ssi sib ibl ble __t _to __k _kn kno now __e _ex exa xac act ctl tly __b _bu but __i _im __c _cu cur uri rio iou ous __w _wh wha hat __e _ev eve ver ery ryo yon one nes __b _be bes est __g _gu gue ues ess __w _wo wou oul uld __b _be __f _fo for __h _ho how __m _mu muc uch __m _mo mon one ney __i _it itd __t _ta tak ake __t _to __b _bu buy __a _al all __t _th tha hat __p _pa pat ath thf hfi fin ind nde der __b _bo boo ook oks ks? __i _im __m _ma mai ain inl nly __t _ta tal alk lki kin ing __a _ab abo bou out __a _an any __b _bo boo ook oks __t _th tha hat __c _co com ome __i _in __h _ha har ard rdb dba bac ack __b _bu but __a _al als lso __b _bo box oxe xes __a _an and __a _ad adv dve ven ent ntu tur ure res es. __i _im __j _ju jus ust __c _cu cur uri rio iou ous __i _if __s _so som ome meo eon one __w _we wer ere __r _ri ric ich __h _ho how __m _mu muc uch __t _th the hey __w _wo wou oul uld __h _ha hav ave __t _to __s _sp spe pen end __t _to too __g _ge get __a __v _va vas ast __p _pa pat ath thf hfi fin ind nde der __l _li lib ibr bra rar ary __l _lo lol olt lth tha han ank nks ks!,0.21333334,0.026666667,0.0,0.013333334,0.0,0.0,0.0,0.0,0.16,0.013333334,0.0,0.0,0.013333334,0.08,0.04,0.10666667,0.0,0.0,0.013333334,0.026666667,0.0,0.13333334,0.013333334,0.0,0.026666667,0.0,0.24,0.026666667,0.10666667,0.0,0.053333335,0.04,0.093333334,0.0,0.013333334,0.0,0.0,0.0,0.04,0.17333333,0.0,0.61333334,0.013333334,0.0,0.0,0.12,0.0,0.0,0.06666667,0.013333334,0.06666667,0.0,0.0,0.0,0.0,0.04,0.06666667,0.0,0.0,0.013333334,0.013333334,0.04,0.04,0.12,0.16,0.18666667,0.013333334,0.13333334,0.0,0.026666667,0.013333334,0.04,0.0,0.0,0.0,0.0,0.026666667,0.0,0.10666667,0.0,0.10666667,0.22666667,0.0,0.0,0.0,1
a4k8vd,linking object to bone problem,2.0,4.0,30.0,blender,tried to search before i came here  thanks for reading  i sculpted a teddy bear  i have 8 total bones in place for ears arms head body and legs  i dont know how to link them in order to move forward for animation  the bear is one object  ive seen people sculpt an entire body as one object and use bones properly  can you help me ,2965.0,37674.0,0.75,2018-12-09 13:11:53,hildrisking,0.0,0.0,5.0,330.0,66.0,54,"__t _tr tri rie ied __t _to __s _se sea ear arc rch __b _be bef efo for ore __i __c _ca cam ame __h _he her ere re, __t _th tha han ank nks __f _fo for __r _re rea ead adi din ing ng. __i __s _sc scu cul ulp lpt pte ted __a __t _te ted edd ddy __b _be bea ear ar, __i __h _ha hav ave __8 __t _to tot ota tal __b _bo bon one nes __i _in __p _pl pla lac ace __f _fo for __e _ea ear ars __a _ar arm rms __h _he hea ead __b _bo bod ody __a _an and __l _le leg egs gs. __i __d _do don ont __k _kn kno now __h _ho how __t _to __l _li lin ink __t _th the hem __i _in __o _or ord rde der __t _to __m _mo mov ove __f _fo for orw rwa war ard __f _fo for __a _an ani nim ima mat ati tio ion on. __t _th the __b _be bea ear __i _is __o _on one __o _ob obj bje jec ect ct, __i _iv ive __s _se see een __p _pe peo eop opl ple __s _sc scu cul ulp lpt __a _an __e _en ent nti tir ire __b _bo bod ody __a _as __o _on one __o _ob obj bje jec ect __a _an and __u _us use __b _bo bon one nes __p _pr pro rop ope per erl rly ly, __c _ca can __y _yo you __h _he hel elp __m _me me?",0.09090909,0.0,0.0,0.0,0.0,0.0,0.0,0.0,0.0,0.09090909,0.0,0.0,0.0,0.09090909,0.0,0.18181819,0.0,0.0,0.0,0.09090909,0.0,0.18181819,0.09090909,0.0,0.0,0.0,0.09090909,0.0,0.0,0.0,0.0,0.0,0.18181819,0.0,0.0,0.0,0.0,0.0,0.0,0.18181819,0.0,0.36363637,0.09090909,0.0,0.0,0.0,0.0,0.0,0.09090909,0.0,0.0,0.0,0.0,0.0,0.0,0.0,0.09090909,0.0,0.0,0.0,0.0,0.09090909,0.09090909,0.0,0.09090909,0.0,0.0,0.0,0.0,0.09090909,0.0,0.09090909,0.0,0.0,0.0,0.09090909,0.0,0.0,0.0,0.0,0.0,0.27272728,0.0,0.0,0.0,1
3bkkcd,a research question,2.0,0.0,19.0,shittyaskscience,im designing a protocol to try and find out how many people die of cancer  i considered asking how many people knew someone who have died of cancer  however i fear the results may be invalidated because someone who died may have been known by more than one respondent  would it be more scientifically valid to just straight up ask if the respondent had died of cancer ,4340.0,6582.0,0.76,2015-06-30 02:52:54,idontlikeyonge,0.0,0.0,3.0,371.0,67.0,50,__i _im __d _de des esi sig ign gni nin ing __a __p _pr pro rot oto toc oco col __t _to __t _tr try __a _an and __f _fi fin ind __o _ou out __h _ho how __m _ma man any __p _pe peo eop opl ple __d _di die __o _of __c _ca can anc nce cer er. __i __c _co con ons nsi sid ide der ere red __a _as ask ski kin ing __h _ho how __m _ma man any __p _pe peo eop opl ple __k _kn kne new __s _so som ome meo eon one __w _wh who __h _ha hav ave __d _di die ied __o _of __c _ca can anc nce cer er. __h _ho how owe wev eve ver __i __f _fe fea ear __t _th the __r _re res esu sul ult lts __m _ma may __b _be __i _in inv nva val ali lid ida dat ate ted __b _be bec eca cau aus use __s _so som ome meo eon one __w _wh who __d _di die ied __m _ma may __h _ha hav ave __b _be bee een __k _kn kno now own __b _by __m _mo mor ore __t _th tha han __o _on one __r _re res esp spo pon ond nde den ent nt. __w _wo wou oul uld __i _it __b _be __m _mo mor ore __s _sc sci cie ien ent nti tif ifi fic ica cal all lly __v _va val ali lid __t _to __j _ju jus ust __s _st str tra rai aig igh ght __u _up __a _as ask __i _if __t _th the __r _re res esp spo pon ond nde den ent __h _ha had __d _di die ied __o _of __c _ca can anc nce cer er?,0.0,0.0,0.0,0.0,0.0,0.0,0.0,0.0,0.0,0.0,0.0,0.0,0.0,0.0,0.0,0.0,0.0,0.0,0.0,0.0,0.0,0.0,0.0,0.0,0.0,0.0,0.0,0.0,0.0,0.0,0.0,0.0,0.0,0.0,0.0,0.0,0.0,0.0,0.0,0.0,0.0,0.0,0.0,0.0,0.0,0.0,0.0,0.0,0.0,0.0,0.0,0.0,0.0,0.0,0.0,0.0,0.0,0.0,0.0,0.0,0.0,0.0,0.0,0.0,0.0,0.0,0.0,0.0,0.0,0.0,0.0,0.0,0.0,0.0,0.0,0.0,0.0,0.0,0.0,0.0,0.0,0.0,0.0,0.0,0.0,1
61yi12,"morning magathread: great deals on uranium, get in here now!",3719.0,250.0,60.0,The_Donald, доброе утро  многоножки              is there a country thats just getting on your nerves  did you hear that raccoon looking cunt merkel mutter something under their breath again at the last un security council meeting and youd like to find out whats really on her mind did that bitch really say kylie jenner is overrated and shes totally team kendall   sort all your problems out and more by just blowing them away with hot  hot  sexy nuclear radiation          nuclear attacks are a quick  easy way of getting the things you need  quickly  want that sexy  shaven headed look but dont have the time to go to the barbers  lose all your hair in nuclear fallout  ever wanted super strength or the ability to move things with your mind  well you might mutate  have you ever wanted to revert civilisation back to the pre medieval agrarian era  nuclear winter will wipe out all sentient thought  old timey  rustic  historical  fun for just 20 regular monthly payments of  10 999 99 this could all be yours  order in the next hour and well even throw in a free pen call 1 234 democrats and our russian agents will be live to take your calls  calling from saudi arabia  dont worry  we will eject all women from the room when we talk to you  democrat uranium  хороший ,192217.0,106174.0,0.94,2017-03-28 13:17:32,hennny,0.0,0.0,10.0,1288.0,219.0,152,"__# _#д #до доб обр бро рое __у _ут утр тро ро, __м _мн мно ног ого гон оно нож ожк жки ки! и!- !-- --- --- --- --- --- --- --- --- --- --- --- --i -is __t _th the her ere __a __c _co cou oun unt ntr try __t _th tha hat ats __j _ju jus ust __g _ge get ett tti tin ing __o _on __y _yo you our __n _ne ner erv rve ves es? __d _di did __y _yo you __h _he hea ear __t _th tha hat __r _ra rac acc cco coo oon on- n-l -lo loo ook oki kin ing __c _cu cun unt __m _me mer erk rke kel __m _mu mut utt tte ter __s _so som ome met eth thi hin ing __u _un und nde der __t _th the hei eir __b _br bre rea eat ath __a _ag aga gai ain __a _at __t _th the __l _la las ast __u _un __s _se sec ecu cur uri rit ity __c _co cou oun unc nci cil __m _me mee eet eti tin ing __a _an and __y _yo you oud __l _li lik ike __t _to __f _fi fin ind __o _ou out __w _wh wha hat ats __r _re rea eal all lly __o _on __h _he her __m _mi min ind nd? d?d ?di did __t _th tha hat __b _bi bit itc tch __r _re rea eal all lly __s _sa say __k _ky kyl yli lie __j _je jen enn nne ner __i _is __o _ov ove ver err rra rat ate ted __a _an and __s _sh she hes __t _to tot ota tal all lly __t _te tea eam __k _ke ken end nda dal all ll? l?? ??# ?#s #so sor ort __a _al all __y _yo you our __p _pr pro rob obl ble lem ems __o _ou out __a _an and __m _mo mor ore __b _by __j _ju jus ust __b _bl blo low owi win ing __t _th the hem __a _aw awa way __w _wi wit ith __h _ho hot ot, __h _ho hot ot, __s _se sex exy __n _nu nuc ucl cle lea ear __r _ra rad adi dia iat ati tio ion on! n!- !-- --- --- --- --- --- --- --- --n -nu nuc ucl cle lea ear __a _at att tta tac ack cks __a _ar are __a __q _qu qui uic ick ck, __e _ea eas asy __w _wa way __o _of __g _ge get ett tti tin ing __t _th the __t _th thi hin ing ngs __y _yo you __n _ne nee eed ed- __q _qu qui uic ick ckl kly ly! __w _wa wan ant __t _th tha hat __s _se sex exy xy, __s _sh sha hav ave ven __h _he hea ead ade ded __l _lo loo ook __b _bu but __d _do don ont __h _ha hav ave __t _th the __t _ti tim ime __t _to __g _go __t _to __t _th the __b _ba bar arb rbe ber ers rs? __l _lo los ose __a _al all __y _yo you our __h _ha hai air __i _in __n _nu nuc ucl cle lea ear __f _fa fal all llo lou out ut! __e _ev eve ver __w _wa wan ant nte ted __s _su sup upe per __s _st str tre ren eng ngt gth __o _or __t _th the __a _ab abi bil ili lit ity __t _to __m _mo mov ove __t _th thi hin ing ngs __w _wi wit ith __y _yo you our __m _mi min ind nd? __w _we wel ell __y _yo you __m _mi mig igh ght __m _mu mut uta tat ate te! __h _ha hav ave __y _yo you __e _ev eve ver __w _wa wan ant nte ted __t _to __r _re rev eve ver ert __c _ci civ ivi vil ili lis isa sat ati tio ion __b _ba bac ack __t _to __t _th the __p _pr pre re- e-m -me med edi die iev eva val __a _ag agr gra rar ari ria ian __e _er era ra? __n _nu nuc ucl cle lea ear __w _wi win int nte ter __w _wi wil ill __w _wi wip ipe __o _ou out __a _al all __s _se sen ent nti tie ien ent __t _th tho hou oug ugh ght ht! __o _ol old __t _ti tim ime mey ey! __r _ru rus ust sti tic ic! __h _hi his ist sto tor ori ric ica cal al! __f _fu fun un! n!f !fo for __j _ju jus ust __2 _20 __r _re reg egu gul ula lar __m _mo mon ont nth thl hly __p _pa pay aym yme men ent nts __o _of __$ _$1 $10 10, 0,9 ,99 999 99. 9.9 .99 __t _th thi his __c _co cou oul uld __a _al all __b _be __y _yo you our urs rs! __o _or ord rde der __i _in __t _th the __n _ne nex ext __h _ho hou our __a _an and __w _we wel ell __e _ev eve ven __t _th thr hro row __i _in __a __f _fr fre ree __p _pe pen en! n!c !ca cal all __1 _1- 1-2 -23 234 34- 4-d -de dem emo moc ocr cra rat ats __a _an and __o _ou our __r _ru rus uss ssi sia ian __a _ag age gen ent nts __w _wi wil ill __b _be __l _li liv ive __t _to __t _ta tak ake __y _yo you our __c _ca cal all lls ls. __c _ca cal all lli lin ing __f _fr fro rom __s _sa sau aud udi __a _ar ara rab abi bia ia? __d _do don ont __w _wo wor orr rry ry, __w _we __w _wi wil ill __e _ej eje jec ect __a _al all __w _wo wom ome men __f _fr fro rom __t _th the __r _ro roo oom __w _wh whe hen __w _we __t _ta tal alk __t _to __y _yo you ou! u!# !#d #de dem emo moc ocr cra rat __u _ur ura ran ani niu ium um: __х _хо хор оро рош оши ший ий!",0.11594203,0.014492753999999997,0.007246376999999998,0.0,0.0,0.007246376999999998,0.007246376999999998,0.0,0.057971015999999986,0.02173913,0.0,0.0,0.028985508,0.050724637,0.07971015,0.06521739,0.02173913,0.0,0.014492753999999997,0.028985508,0.0,0.10869565,0.0,0.0,0.028985508,0.014492753999999997,0.13043478,0.028985508,0.123188406,0.0,0.036231883,0.04347826,0.07971015,0.0,0.007246376999999998,0.0,0.0,0.014492753999999997,0.050724637,0.11594203,0.007246376999999998,0.54347825,0.0,0.007246376999999998,0.0,0.07971015,0.0,0.0,0.007246376999999998,0.02173913,0.07971015,0.02173913,0.007246376999999998,0.014492753999999997,0.02173913,0.007246376999999998,0.028985508,0.0,0.0,0.072463766,0.02173913,0.036231883,0.007246376999999998,0.10144927,0.07971015,0.18115942,0.02173913,0.1594203,0.0,0.028985508,0.014492753999999997,0.0,0.007246376999999998,0.0,0.0,0.057971015999999986,0.08695652,0.0,0.057971015999999986,0.0,0.050724637,0.19565217,0.0,0.0,0.02173913,1
