submission_id,title,score,num_comments,title_length,subreddit,post_text,comment_karma,link_karma,upvote_ratio,date_created,user_name,appearance,text_changed,num_words_title,post_length,num_words_post,num_distinct_words,trigrams,AllPunc,Apostro,Colon,Comma,Dash,Exclam,OtherP,Parenth,Period,QMark,Quote,SemiC,achieve,adj,adverb,affect,affiliation,anger,anx,article,assent,auxverb,bio,body,cause,certain,cogproc,compare,conj,death,differ,discrep,drives,family,feel,female,filler,focusfuture,focuspast,focuspresent,friend,function,health,hear,home,i,informal,ingest,insight,interrog,ipron,leisure,male,money,motion,negate,negemo,netspeak,nonflu,number,percept,posemo,power,ppron,prep,pronoun,quant,relativ,relig,reward,risk,sad,see,sexual,shehe,social,space,swear,tentat,they,time,verb,we,work,you,is_depressed
270r8i,eli5: what's the difference between a so-called 'europarty' and party groups in the european parliament?,1.0,0.0,104.0,explainlikeimfive,ive been reading quite a lot into the structure of the european union  and noticed that there were two different types of europarties   the political parties at a european level  and party groups in the european parliament  for instance  the european socialist party exists on a european scale  but the progressive alliance of socialists and democrats represent them in the european parliament  why is this the case  why not just have one party  represented in parliament  be it eps or pasd thanks    ,8471.0,628.0,0.67,2014-06-01 12:52:48,mrwbrightside,0.0,0.0,15.0,510.0,84.0,60,"__i _iv ive __b _be bee een __r _re rea ead adi din ing __q _qu qui uit ite __a __l _lo lot __i _in int nto __t _th the __s _st str tru ruc uct ctu tur ure __o _of __t _th the __e _eu eur uro rop ope pea ean __u _un uni nio ion on, __a _an and __n _no not oti tic ice ced __t _th tha hat __t _th the her ere __w _we wer ere __t _tw two __d _di dif iff ffe fer ere ren ent __t _ty typ ype pes __o _of __e _eu eur uro rop opa par art rti tie ies __- __t _th the __p _po pol oli lit iti tic ica cal __p _pa par art rti tie ies __a _at __a __e _eu eur uro rop ope pea ean __l _le lev eve vel el, __a _an and __p _pa par art rty __g _gr gro rou oup ups __i _in __t _th the __e _eu eur uro rop ope pea ean __p _pa par arl rli lia iam ame men ent nt. __f _fo for __i _in ins nst sta tan anc nce ce, __t _th the __e _eu eur uro rop ope pea ean __s _so soc oci cia ial ali lis ist __p _pa par art rty __e _ex exi xis ist sts __o _on __a __e _eu eur uro rop ope pea ean __s _sc sca cal ale le, __b _bu but __t _th the __p _pr pro rog ogr gre res ess ssi siv ive __a _al all lli lia ian anc nce __o _of __s _so soc oci cia ial ali lis ist sts __a _an and __d _de dem emo moc ocr cra rat ats __r _re rep epr pre res ese sen ent __t _th the hem __i _in __t _th the __e _eu eur uro rop ope pea ean __p _pa par arl rli lia iam ame men ent nt. __w _wh why __i _is __t _th thi his __t _th the __c _ca cas ase se? __w _wh why __n _no not __j _ju jus ust __h _ha hav ave __o _on one __p _pa par art rty ty, __r _re rep epr pre res ese sen ent nte ted __i _in __p _pa par arl rli lia iam ame men ent nt, __b _be __i _it __e _ep eps __o _or __p _pa pas asd sd? d?t ?th tha han ank nks ks! __: _:)",0.0,0.0,0.0,0.0,0.0,0.0,0.0,0.0,0.0,0.0,0.0,0.0,0.0,0.0,0.0,0.0,0.0,0.0,0.0,0.0,0.0,0.0,0.0,0.0,0.0,0.0,0.0,0.0,0.0,0.0,0.0,0.0,0.0,0.0,0.0,0.0,0.0,0.0,0.0,0.0,0.0,0.0,0.0,0.0,0.0,0.0,0.0,0.0,0.0,0.0,0.0,0.0,0.0,0.0,0.0,0.0,0.0,0.0,0.0,0.0,0.0,0.0,0.0,0.0,0.0,0.0,0.0,0.0,0.0,0.0,0.0,0.0,0.0,0.0,0.0,0.0,0.0,0.0,0.0,0.0,0.0,0.0,0.0,0.0,0.0,1
9ms5vp,should able beard growing men shave?,1.0,0.0,36.0,NoStupidQuestions,i am actually at 4 days  day 5 later today i havent gotten morning wood in my small streaks since probably 5 6 weeks ago i have no morning wood  whats going on  no urges  no erections  and when i relapse  it is not even good compared to when i was getting strong erections and urges what can i do ,5.0,121.0,1.0,2018-10-09 07:11:48,lastbullets,0.0,0.0,6.0,311.0,59.0,48,"__i __a _am __a _ac act ctu tua ual all lly __a _at __4 __d _da day ays ys, __d _da day __5 __l _la lat ate ter __t _to tod oda day ay. y.i __h _ha hav ave ven ent __g _go got ott tte ten __m _mo mor orn rni nin ing __w _wo woo ood __i _in __m _my __s _sm sma mal all __s _st str tre rea eak aks __s _si sin inc nce __p _pr pro rob oba bab abl bly __5 _5- 5-6 __w _we wee eek eks __a _ag ago go. o.i __h _ha hav ave __n _no __m _mo mor orn rni nin ing __w _wo woo ood od, __w _wh wha hat ats __g _go goi oin ing __o _on on? __n _no __u _ur urg rge ges es, __n _no __e _er ere rec ect cti tio ion ons ns, __a _an and __w _wh whe hen __i __r _re rel ela lap aps pse se, __i _it __i _is __n _no not __e _ev eve ven __g _go goo ood __c _co com omp mpa par are red __t _to __w _wh whe hen __i __w _wa was __g _ge get ett tti tin ing __s _st str tro ron ong __e _er ere rec ect cti tio ion ons __a _an and __u _ur urg rge ges es. s.w .wh wha hat __c _ca can __i __d _do do?",0.31026253,0.0,0.002386635,0.081145585,0.13603818,0.002386635,0.016706443999999997,0.0,0.047732696,0.0,0.023866348,0.0,0.0,0.050119333,0.050119333,0.081145585,0.03818616,0.045346063,0.002386635,0.07875895,0.007159904599999998,0.052505966,0.00954654,0.00477327,0.021479713,0.01909308,0.13842481,0.03341289,0.081145585,0.0,0.05966587,0.00954654,0.07875895,0.0,0.007159904599999998,0.00477327,0.0,0.00477327,0.028639618,0.07398568,0.0,0.44868734,0.0,0.002386635,0.0,0.007159904599999998,0.031026253,0.0,0.011933174,0.028639618,0.07875895,0.028639618,0.011933174,0.00477327,0.021479713,0.016706443999999997,0.06443914,0.011933174,0.0,0.002386635,0.026252983,0.016706443999999997,0.035799522,0.023866348,0.10739857,0.102625296,0.021479713,0.12649165,0.0,0.002386635,0.002386635,0.002386635,0.016706443999999997,0.00477327,0.00477327,0.12171838,0.050119333,0.011933174,0.031026253,0.00477327,0.054892599999999986,0.12171838,0.002386635,0.007159904599999998,0.00477327,1
99hqqc,film influences and nods you've noticed in game of thrones?,17.0,25.0,59.0,freefolk,"as writers  d d are obviously connoisseurs of great films and television and influenced by it as well  weve got the  opening sequence   https   www youtube com watch v  kbvdvc wfe of ""winds of winter"" in which everyone prepares for the trial and cersei blows up the sept  which seemed an obvious homage to the  baptism sequence  https   www youtube com watch v khbqr6xsy8u  in  the godfather   i think d d themselves may have cited this as inspiration     weve got  jon snows mercy killing of mance rayder  https   www youtube com watch v fdiftgdhuam  as hes burned at the stake  which seemed like a nod to  hawkeyes killing of duncan  https   vimeo com 141637178  in  last of the mohicans   also  shout out to maggy the frog at 5 11 when her name was alice and she was young and in love with uncas   what homages nods to other film and television have you noticed  ",47023.0,2331.0,0.87,2018-08-23 01:19:24,sleuthwood,0.0,0.0,10.0,877.0,124.0,89,"__a _as __w _wr wri rit ite ter ers rs, __d _d& d&d __a _ar are __o _ob obv bvi vio iou ous usl sly __c _co con onn nno noi ois iss sse seu eur urs __o _of __g _gr gre rea eat __f _fi fil ilm lms __a _an and __t _te tel ele lev evi vis isi sio ion __a _an and __i _in inf nfl flu lue uen enc nce ced __b _by __i _it __a _as __w _we wel ell ll. __w _we wev eve __g _go got __t _th the __[ _[o [op ope pen eni nin ing __s _se seq equ que uen enc nce __] _]( ](h (ht htt ttp tps ps: s:/ :// //w /ww www ww. w.y .yo you out utu tub ube be. e.c .co com om/ m/w /wa wat atc tch ch? h?v ?v= v=_ =_k _kb kbv bvd vdv dvc vc- c-w -wf wfe fe) e)o )of __"" _""w ""wi win ind nds __o _of __w _wi win int nte ter er"" __i _in __w _wh whi hic ich __e _ev eve ver ery ryo yon one __p _pr pre rep epa par are res __f _fo for __t _th the __t _tr tri ria ial __a _an and __c _ce cer ers rse sei __b _bl blo low ows __u _up __t _th the __s _se sep ept pt, __w _wh whi hic ich __s _se see eem eme med __a _an __o _ob obv bvi vio iou ous __h _ho hom oma mag age __t _to __t _th the __[ _[b [ba bap apt pti tis ism __s _se seq equ que uen enc nce ce] e]( ](h (ht htt ttp tps ps: s:/ :// //w /ww www ww. w.y .yo you out utu tub ube be. e.c .co com om/ m/w /wa wat atc tch ch? h?v ?v= v=k =kh khb hbq bqr qr6 r6x 6xs xsy sy8 y8u 8u) __i _in __* _*t *th the __g _go god odf dfa fat ath the her er* __( _(i __t _th thi hin ink __d _d& d&d __t _th the hem ems mse sel elv lve ves __m _ma may __h _ha hav ave __c _ci cit ite ted __t _th thi his __a _as __i _in ins nsp spi pir ira rat ati tio ion on) n). ).* .*. *.* .*w *we wev eve __g _go got __[ _[j [jo jon __s _sn sno now ows __m _me mer erc rcy __k _ki kil ill lli lin ing __o _of __m _ma man anc nce __r _ra ray ayd yde der er] r]( ](h (ht htt ttp tps ps: s:/ :// //w /ww www ww. w.y .yo you out utu tub ube be. e.c .co com om/ m/w /wa wat atc tch ch? h?v ?v= v=f =fd fdi dif ift ftg tgd gdh dhu hua uam am) __a _as __h _he hes __b _bu bur urn rne ned __a _at __t _th the __s _st sta tak ake ke, __w _wh whi hic ich __s _se see eem eme med __l _li lik ike __a __n _no nod __t _to __[ _[h [ha haw awk wke key eye yes __k _ki kil ill lli lin ing __o _of __d _du dun unc nca can an] n]( ](h (ht htt ttp tps ps: s:/ :// //v /vi vim ime meo eo. o.c .co com om/ m/1 /14 141 416 163 637 371 717 178 78) __i _in __* _*l *la las ast __o _of __t _th the __m _mo moh ohi hic ica can ans ns* __( _(a (al als lso so, __s _sh sho hou out __o _ou out __t _to __m _ma mag agg ggy __t _th the __f _fr fro rog __a _at __5 _5: 5:1 :11 __w _wh whe hen __h _he her __n _na nam ame __w _wa was __a _al ali lic ice __a _an and __s _sh she __w _wa was __y _yo you oun ung __a _an and __i _in __l _lo lov ove __w _wi wit ith __u _un unc nca cas as) s). __w _wh wha hat __h _ho hom oma mag age ges es/ s/n /no nod ods __t _to __o _ot oth the her __f _fi fil ilm __a _an and __t _te tel ele lev evi vis isi sio ion __h _ha hav ave __y _yo you __n _no not oti tic ice ced ed?",0.3,0.0,0.0,0.0,0.0,0.0,0.0,0.0,0.3,0.0,0.0,0.0,0.0,0.0,0.0,0.2,0.0,0.1,0.0,0.1,0.0,0.1,0.0,0.0,0.1,0.1,0.3,0.0,0.0,0.0,0.0,0.1,0.1,0.0,0.0,0.0,0.0,0.0,0.0,0.2,0.0,0.5,0.0,0.0,0.0,0.1,0.1,0.0,0.0,0.0,0.1,0.0,0.0,0.1,0.0,0.0,0.2,0.0,0.0,0.0,0.0,0.0,0.0,0.1,0.1,0.2,0.1,0.0,0.0,0.0,0.1,0.0,0.0,0.0,0.0,0.0,0.0,0.1,0.0,0.0,0.0,0.2,0.0,0.0,0.0,1
88czwf,so a man crashes his plane onto a deserted island...,41.0,4.0,52.0,Jokes,after a while of being alone the man begins to grow incredibly horny  he spots a donkey off in the distance and decides to go for it  the donkey isn’t having any of it and quickly evades the man  years go by and he still just can’t catch the damn donkey  one day an unconscious woman washes up on the shore  so the man quickly runs up and gives her mouth to mouth  the woman jumps up and says “oh my god  you saved my life  i’d do anything to repay you ” the man turns to her and exclaims “oh thank fuck  can you please hold this donkey still for me ”,1997.0,47365.0,0.81,2018-03-30 12:26:08,airnlight_timenspace,0.0,0.0,10.0,551.0,111.0,76,"__a _af aft fte ter __a __w _wh whi hil ile __o _of __b _be bei ein ing __a _al alo lon one __t _th the __m _ma man __b _be beg egi gin ins __t _to __g _gr gro row __i _in inc ncr cre red edi dib ibl bly __h _ho hor orn rny ny. __h _he __s _sp spo pot ots __a __d _do don onk nke key __o _of off __i _in __t _th the __d _di dis ist sta tan anc nce __a _an and __d _de dec eci cid ide des __t _to __g _go __f _fo for __i _it it. __t _th the __d _do don onk nke key __i _is isn sn’ n’t __h _ha hav avi vin ing __a _an any __o _of __i _it __a _an and __q _qu qui uic ick ckl kly __e _ev eva vad ade des __t _th the __m _ma man an. __y _ye yea ear ars __g _go __b _by __a _an and __h _he __s _st sti til ill __j _ju jus ust __c _ca can an’ n’t __c _ca cat atc tch __t _th the __d _da dam amn __d _do don onk nke key ey. __o _on one __d _da day __a _an __u _un unc nco con ons nsc sci cio iou ous __w _wo wom oma man __w _wa was ash she hes __u _up __o _on __t _th the __s _sh sho hor ore re, __s _so __t _th the __m _ma man __q _qu qui uic ick ckl kly __r _ru run uns __u _up __a _an and __g _gi giv ive ves __h _he her __m _mo mou out uth __t _to __m _mo mou out uth th. __t _th the __w _wo wom oma man __j _ju jum ump mps __u _up __a _an and __s _sa say ays __“ _“o “oh __m _my __g _go god od, __y _yo you __s _sa sav ave ved __m _my __l _li lif ife fe. __i _i’ i’d __d _do __a _an any nyt yth thi hin ing __t _to __r _re rep epa pay __y _yo you ou. u.” __t _th the __m _ma man __t _tu tur urn rns __t _to __h _he her __a _an and __e _ex exc xcl cla lai aim ims __“ _“o “oh __t _th tha han ank __f _fu fuc uck ck! __c _ca can __y _yo you __p _pl ple lea eas ase __h _ho hol old __t _th thi his __d _do don onk nke key __s _st sti til ill __f _fo for __m _me me? e?”",0.15656565,0.060606062,0.0,0.030303031,0.0,0.0,0.0,0.0,0.065656565,0.0,0.0,0.0,0.01010101,0.055555556,0.08080808,0.08585858,0.005050505,0.015151516,0.015151516,0.030303031,0.0,0.13636364,0.060606062,0.005050505,0.015151516,0.005050505,0.14646465,0.025252525,0.08585858,0.0,0.045454547000000005,0.035353534,0.065656565,0.0,0.005050505,0.0,0.0,0.02020202,0.015151516,0.18181819,0.0,0.63131315,0.055555556,0.0,0.0,0.14141414,0.01010101,0.025252525,0.035353534,0.015151516,0.10606061,0.0,0.0,0.0,0.015151516,0.02020202,0.05050505,0.0,0.005050505,0.0,0.01010101,0.035353534,0.015151516,0.16161616,0.1010101,0.26767677,0.025252525,0.1010101,0.0,0.035353534,0.005050505,0.015151516,0.005050505,0.0,0.0,0.035353534,0.045454547000000005,0.005050505,0.030303031,0.02020202,0.030303031,0.26262626,0.0,0.01010101,0.0,1
98jct6,is there a way to receive push notifications without gapps (and microg) installed?,3.0,1.0,82.0,AndroidQuestions,i  use lineageos without google applications and services  its mostly  fine as there are very good alternatives available on the f droid  appstore and even most applications i use from the google play store   through yalp  run just fine without gapps the only functionality im missing is the ability to receive push notifications  does anybody know if theres a way to receive them without gapps and without other methods that send your data to google servers  microg  ,642.0,808.0,0.81,2018-08-19 13:26:45,kettu-,0.0,0.0,13.0,473.0,76.0,59,__i __u _us use __l _li lin ine nea eag age geo eos __w _wi wit ith tho hou out __g _go goo oog ogl gle __a _ap app ppl pli lic ica cat ati tio ion ons __a _an and __s _se ser erv rvi vic ice ces es. __i _it its __m _mo mos ost stl tly __f _fi fin ine __a _as __t _th the her ere __a _ar are __v _ve ver ery __g _go goo ood __a _al alt lte ter ern rna nat ati tiv ive ves __a _av ava vai ail ila lab abl ble __o _on __t _th the __f _f- f-d -dr dro roi oid __a _ap app pps pst sto tor ore __a _an and __e _ev eve ven __m _mo mos ost __a _ap app ppl pli lic ica cat ati tio ion ons __i __u _us use __f _fr fro rom __t _th the __g _go goo oog ogl gle __p _pl pla lay __s _st sto tor ore __( _(t (th thr hro rou oug ugh __y _ya yal alp lp) __r _ru run __j _ju jus ust __f _fi fin ine __w _wi wit ith tho hou out __g _ga gap app pps ps. s.t .th the __o _on onl nly __f _fu fun unc nct cti tio ion ona nal ali lit ity __i _im __m _mi mis iss ssi sin ing __i _is __t _th the __a _ab abi bil ili lit ity __t _to __r _re rec ece cei eiv ive __p _pu pus ush __n _no not oti tif ifi fic ica cat ati tio ion ons ns. __d _do doe oes __a _an any nyb ybo bod ody __k _kn kno now __i _if __t _th the her ere res __a __w _wa way __t _to __r _re rec ece cei eiv ive __t _th the hem __w _wi wit ith tho hou out __g _ga gap app pps __a _an and __w _wi wit ith tho hou out __o _ot oth the her __m _me met eth tho hod ods __t _th tha hat __s _se sen end __y _yo you our __d _da dat ata __t _to __g _go goo oog ogl gle __s _se ser erv rve ver ers __( _(m (mi mic icr cro rog og) g)?,0.0,0.0,0.0,0.0,0.0,0.0,0.0,0.0,0.0,0.0,0.0,0.0,0.0,0.0,0.0,0.0,0.0,0.0,0.0,0.0,0.0,0.0,0.0,0.0,0.0,0.0,0.0,0.0,0.0,0.0,0.0,0.0,0.0,0.0,0.0,0.0,0.0,0.0,0.0,0.0,0.0,0.0,0.0,0.0,0.0,0.0,0.0,0.0,0.0,0.0,0.0,0.0,0.0,0.0,0.0,0.0,0.0,0.0,0.0,0.0,0.0,0.0,0.0,0.0,0.0,0.0,0.0,0.0,0.0,0.0,0.0,0.0,0.0,0.0,0.0,0.0,0.0,0.0,0.0,0.0,0.0,0.0,0.0,0.0,0.0,1
7jkgsi,[tomt] [song] 70's-90's instrumental electronic synth song?,2.0,3.0,59.0,tipofmytongue,hello all  im trying to find a specific instrumental synth y song  probably made between the 70s and the 90s i have used a sequencer to recreate it as best as i can  which can be heard  here   https   onlinesequencer net 682019  it can also be heard in the background  here  at 30 07   https   youtu be tlddaurdyiw t 30m7s thanks in advance ,8277.0,7949.0,1.0,2017-12-13 18:41:26,cogs90210,0.0,0.0,7.0,348.0,53.0,39,"__h _he hel ell llo __a _al all ll. __i _im __t _tr try ryi yin ing __t _to __f _fi fin ind __a __s _sp spe pec eci cif ifi fic __i _in ins nst str tru rum ume men ent nta tal __s _sy syn ynt nth th- h-y __s _so son ong ng, __p _pr pro rob oba bab abl bly __m _ma mad ade __b _be bet etw twe wee een __t _th the __7 _70 70s __a _an and __t _th the __9 _90 90s 0s. s.i __h _ha hav ave __u _us use sed __a __s _se seq equ que uen enc nce cer __t _to __r _re rec ecr cre rea eat ate __i _it __a _as __b _be bes est __a _as __i __c _ca can an, __w _wh whi hic ich __c _ca can __b _be __h _he hea ear ard __[ _[h [he her ere re. e.] .]( ](h (ht htt ttp tps ps: s:/ :// //o /on onl nli lin ine nes ese seq equ que uen enc nce cer er. r.n .ne net et/ t/6 /68 682 820 201 019 19) __i _it __c _ca can __a _al als lso __b _be __h _he hea ear ard __i _in __t _th the __b _ba bac ack ckg kgr gro rou oun und __[ _[h [he her ere re, __a _at __3 _30 30: 0:0 :07 07. 7.] .]( ](h (ht htt ttp tps ps: s:/ :// //y /yo you out utu tu. u.b .be be/ e/t /tl tld ldd dda dau aur urd rdy dyi yiw iw? w?t ?t= t=3 =30 30m 0m7 m7s 7s) s)t )th tha han ank nks __i _in __a _ad adv dva van anc nce ce!",0.20955883,0.04411765,0.0,0.080882356,0.0,0.022058824,0.018382354,0.029411765,0.014705882,0.0,0.0,0.0,0.018382354,0.05147059,0.06985294,0.07720588,0.018382354,0.0,0.0036764706,0.022058824,0.0036764706,0.113970585,0.036764707,0.007352941,0.0,0.05882353,0.1764706,0.036764707,0.106617644,0.0,0.029411765,0.022058824,0.05882353,0.0036764706,0.025735294,0.0,0.0,0.014705882,0.066176474,0.12867647,0.0036764706,0.6544118,0.018382354,0.0036764706,0.0036764706,0.15073529,0.022058824,0.0,0.05882353,0.0,0.073529415,0.0036764706,0.0,0.0,0.007352941,0.014705882,0.025735294,0.022058824,0.0,0.0036764706,0.029411765,0.05147059,0.029411765,0.18382353,0.1360294,0.25735295,0.033088237,0.113970585,0.0,0.018382354,0.0036764706,0.018382354,0.0,0.0036764706,0.0,0.073529415,0.066176474,0.0,0.022058824,0.0,0.04411765,0.20588236,0.0,0.007352941,0.033088237,1
41tutn,why do my wide players always try and score rather than pass?,15.0,29.0,61.0,footballmanagergames,why do my wide players   inside forwards  wingers  fullbacks   try and score from an impossibly tight angle rather than square or cross the ball for a man in the middle to score  it doesnt matter whether theyre on support or attack  or if i tell them to shoot less often  they still try and score stupid wonder goals and its infuriating  ,8471.0,628.0,0.9,2016-01-20 12:55:56,mrwbrightside,0.0,0.0,12.0,341.0,62.0,53,"__w _wh why __d _do __m _my __w _wi wid ide __p _pl pla lay aye yer ers __- __i _in ins nsi sid ide __f _fo for orw rwa war ard rds ds, __w _wi win ing nge ger ers rs, __f _fu ful ull llb lba bac ack cks __- __t _tr try __a _an and __s _sc sco cor ore __f _fr fro rom __a _an __i _im imp mpo pos oss ssi sib ibl bly __t _ti tig igh ght __a _an ang ngl gle __r _ra rat ath the her __t _th tha han __s _sq squ qua uar are __o _or __c _cr cro ros oss __t _th the __b _ba bal all __f _fo for __a __m _ma man __i _in __t _th the __m _mi mid idd ddl dle __t _to __s _sc sco cor ore re? __i _it __d _do doe oes esn snt __m _ma mat att tte ter __w _wh whe het eth the her __t _th the hey eyr yre __o _on __s _su sup upp ppo por ort __o _or __a _at att tta tac ack ck, __o _or __i _if __i __t _te tel ell __t _th the hem __t _to __s _sh sho hoo oot __l _le les ess __o _of oft fte ten en, __t _th the hey __s _st sti til ill __t _tr try __a _an and __s _sc sco cor ore __s _st stu tup upi pid __w _wo won ond nde der er- r-g -go goa oal als __a _an and __i _it its __i _in inf nfu fur uri ria iat ati tin ing ng.",0.0,0.0,0.0,0.0,0.0,0.0,0.0,0.0,0.0,0.0,0.0,0.0,0.0,0.0,0.0,0.0,0.0,0.0,0.0,0.0,0.0,0.0,0.0,0.0,0.0,0.0,0.0,0.0,0.0,0.0,0.0,0.0,0.0,0.0,0.0,0.0,0.0,0.0,0.0,0.0,0.0,0.0,0.0,0.0,0.0,0.0,0.0,0.0,0.0,0.0,0.0,0.0,0.0,0.0,0.0,0.0,0.0,0.0,0.0,0.0,0.0,0.0,0.0,0.0,0.0,0.0,0.0,0.0,0.0,0.0,0.0,0.0,0.0,0.0,0.0,0.0,0.0,0.0,0.0,0.0,0.0,0.0,0.0,0.0,0.0,1
3t39rv,what fire emblem game should my friend start with?,6.0,13.0,50.0,fireemblem,my friend wants to start playing fire emblem and asked me which one he should play 1st  i had played shadow dragon  awakening and new mystery of the emblem  which i patched  around the same time  im think rekka no ken would be a good 1st game  what do you guys think ,2753.0,5293.0,0.78,2015-11-16 16:23:07,jmaalouf,0.0,0.0,9.0,268.0,52.0,48,"__m _my __f _fr fri rie ien end __w _wa wan ant nts __t _to __s _st sta tar art __p _pl pla lay ayi yin ing __f _fi fir ire __e _em emb mbl ble lem __a _an and __a _as ask ske ked __m _me __w _wh whi hic ich __o _on one __h _he __s _sh sho hou oul uld __p _pl pla lay __1 _1s 1st st. __i __h _ha had __p _pl pla lay aye yed __s _sh sha had ado dow __d _dr dra rag ago gon on, __a _aw awa wak ake ken eni nin ing __a _an and __n _ne new __m _my mys yst ste ter ery __o _of __t _th the __e _em emb mbl ble lem __( _(w (wh whi hic ich __i __p _pa pat atc tch che hed ed) __a _ar aro rou oun und __t _th the __s _sa sam ame __t _ti tim ime me. __i _im __t _th thi hin ink __r _re rek ekk kka __n _no __k _ke ken __w _wo wou oul uld __b _be __a __g _go goo ood __1 _1s 1st __g _ga gam ame me. __w _wh wha hat __d _do __y _yo you __g _gu guy uys __t _th thi hin ink nk?",0.45454547,0.0,0.0,0.0,0.0,0.18181819,0.0,0.0,0.27272728,0.0,0.0,0.0,0.0,0.0,0.0,0.0,0.0,0.0,0.0,0.09090909,0.0,0.0,0.0,0.0,0.0,0.0,0.09090909,0.0,0.0,0.0,0.09090909,0.0,0.09090909,0.0,0.0,0.0,0.0,0.0,0.0,0.0,0.09090909,0.54545456,0.0,0.0,0.0,0.09090909,0.0,0.0,0.0,0.0,0.0,0.0,0.09090909,0.0,0.0,0.0,0.0,0.0,0.0,0.0,0.0,0.0,0.09090909,0.09090909,0.36363637,0.09090909,0.0,0.27272728,0.0,0.0,0.0,0.0,0.0,0.0,0.0,0.09090909,0.27272728,0.0,0.0,0.0,0.0,0.0,0.0,0.0,0.0,1
3i53w4,rage,0.0,7.0,4.0,footballmanagergames,sometimes i just give up with this game  i have a perfect tactic  i beat stronger opposition  i win games 5 or 6 nil  then i lose to a team at the bottom of the division  i try and change things  and it doesnt work  nothing works  i concede a goal  it doesnt matter what i do  or dont do  its irrelevant   im so fucking sick of this game  ,8471.0,628.0,0.46,2015-08-24 03:28:48,mrwbrightside,0.0,0.0,1.0,344.0,69.0,51,"__s _so som ome met eti tim ime mes __i __j _ju jus ust __g _gi giv ive __u _up __w _wi wit ith __t _th thi his __g _ga gam ame me. __i __h _ha hav ave __a __p _pe per erf rfe fec ect __t _ta tac act cti tic ic, __i __b _be bea eat __s _st str tro ron ong nge ger __o _op opp ppo pos osi sit iti tio ion on, __i __w _wi win __g _ga gam ame mes __5 __o _or __6 __n _ni nil il. __t _th the hen __i __l _lo los ose __t _to __a __t _te tea eam __a _at __t _th the __b _bo bot ott tto tom __o _of __t _th the __d _di div ivi vis isi sio ion on. __i __t _tr try __a _an and __c _ch cha han ang nge __t _th thi hin ing ngs gs, __a _an and __i _it __d _do doe oes esn snt __w _wo wor ork rk. __n _no not oth thi hin ing __w _wo wor ork rks ks. __i __c _co con onc nce ced ede __a __g _go goa oal al, __i _it __d _do doe oes esn snt __m _ma mat att tte ter __w _wh wha hat __i __d _do do, __o _or __d _do don ont __d _do do, __i _it its __i _ir irr rre rel ele lev eva van ant nt. __i _im __s _so __f _fu fuc uck cki kin ing __s _si sic ick __o _of __t _th thi his __g _ga gam ame me.",0.0,0.0,0.0,0.0,0.0,0.0,0.0,0.0,0.0,0.0,0.0,0.0,0.0,0.0,0.0,0.0,0.0,0.0,0.0,0.0,0.0,0.0,0.0,0.0,0.0,0.0,0.0,0.0,0.0,0.0,0.0,0.0,0.0,0.0,0.0,0.0,0.0,0.0,0.0,0.0,0.0,0.0,0.0,0.0,0.0,0.0,0.0,0.0,0.0,0.0,0.0,0.0,0.0,0.0,0.0,0.0,0.0,0.0,0.0,0.0,0.0,0.0,0.0,0.0,0.0,0.0,0.0,0.0,0.0,0.0,0.0,0.0,0.0,0.0,0.0,0.0,0.0,0.0,0.0,0.0,0.0,0.0,0.0,0.0,0.0,1
