submission_id,title,score,num_comments,title_length,subreddit,post_text,comment_karma,link_karma,upvote_ratio,date_created,user_name,appearance,text_changed,num_words_title,post_length,num_words_post,num_distinct_words,trigrams,AllPunc,Apostro,Colon,Comma,Dash,Exclam,OtherP,Parenth,Period,QMark,Quote,SemiC,achieve,adj,adverb,affect,affiliation,anger,anx,article,assent,auxverb,bio,body,cause,certain,cogproc,compare,conj,death,differ,discrep,drives,family,feel,female,filler,focusfuture,focuspast,focuspresent,friend,function,health,hear,home,i,informal,ingest,insight,interrog,ipron,leisure,male,money,motion,negate,negemo,netspeak,nonflu,number,percept,posemo,power,ppron,prep,pronoun,quant,relativ,relig,reward,risk,sad,see,sexual,shehe,social,space,swear,tentat,they,time,verb,we,work,you,is_depressed
8wlp4d,[tomt][app] music app with blue icon that had lots of playlists,6.0,10.0,63.0,tipofmytongue,there was an app i used years ago  not pandora  not spotify  none of the usual suspects  and it had a lot of playlists on it like similar to pandora you couldn’t choose to listen to whatever songs you want like on spotify but it had playlists based on genre  mood  and probably artists  the icon was blue and i want to say the “mascot” was a whale or shark or something  i haven’t been able to find anything on it so i’m guessing it probably doesn’t exist anymore but there was a playlist i listened to when i walked on the beach and i just associate a lot of that music with the beach now and was hoping to find it  even if that’s not possible i’d at least like some closure by knowing this was a real thing that i didn’t make up  i feel like it may have started with an s but i could be totally off on that ,1745.0,3114.0,0.71,2018-07-06 19:56:48,ghostmutt8,0.0,0.0,11.0,809.0,163.0,100,"__t _th the her ere __w _wa was __a _an __a _ap app __i __u _us use sed __y _ye yea ear ars __a _ag ago __( _(n (no not __p _pa pan and ndo dor ora ra, __n _no not __s _sp spo pot oti tif ify fy, __n _no non one __o _of __t _th the __u _us usu sua ual __s _su sus usp spe pec ect cts ts) __a _an and __i _it __h _ha had __a __l _lo lot __o _of __p _pl pla lay ayl yli lis ist sts __o _on __i _it __l _li lik ike __s _si sim imi mil ila lar __t _to __p _pa pan and ndo dor ora __y _yo you __c _co cou oul uld ldn dn’ n’t __c _ch cho hoo oos ose __t _to __l _li lis ist ste ten __t _to __w _wh wha hat ate tev eve ver __s _so son ong ngs __y _yo you __w _wa wan ant __l _li lik ike __o _on __s _sp spo pot oti tif ify __b _bu but __i _it __h _ha had __p _pl pla lay ayl yli lis ist sts __b _ba bas ase sed __o _on __g _ge gen enr nre re, __m _mo moo ood od, __a _an and __p _pr pro rob oba bab abl bly __a _ar art rti tis ist sts ts. __t _th the __i _ic ico con __w _wa was __b _bl blu lue __a _an and __i __w _wa wan ant __t _to __s _sa say __t _th the __“ _“m “ma mas asc sco cot ot” __w _wa was __a __w _wh wha hal ale __o _or __s _sh sha har ark __o _or __s _so som ome met eth thi hin ing ng. __i __h _ha hav ave ven en’ n’t __b _be bee een __a _ab abl ble __t _to __f _fi fin ind __a _an any nyt yth thi hin ing __o _on __i _it __s _so __i _i’ i’m __g _gu gue ues ess ssi sin ing __i _it __p _pr pro rob oba bab abl bly __d _do doe oes esn sn’ n’t __e _ex exi xis ist __a _an any nym ymo mor ore __b _bu but __t _th the her ere __w _wa was __a __p _pl pla lay ayl yli lis ist __i __l _li lis ist ste ten ene ned __t _to __w _wh whe hen __i __w _wa wal alk lke ked __o _on __t _th the __b _be bea eac ach __a _an and __i __j _ju jus ust __a _as ass sso soc oci cia iat ate __a __l _lo lot __o _of __t _th tha hat __m _mu mus usi sic __w _wi wit ith __t _th the __b _be bea eac ach __n _no now __a _an and __w _wa was __h _ho hop opi pin ing __t _to __f _fi fin ind __i _it it. __e _ev eve ven __i _if __t _th tha hat at’ t’s __n _no not __p _po pos oss ssi sib ibl ble __i _i’ i’d __a _at __l _le lea eas ast __l _li lik ike __s _so som ome __c _cl clo los osu sur ure __b _by __k _kn kno now owi win ing __t _th thi his __w _wa was __a __r _re rea eal __t _th thi hin ing __t _th tha hat __i __d _di did idn dn’ n’t __m _ma mak ake __u _up up. __i __f _fe fee eel __l _li lik ike __i _it __m _ma may __h _ha hav ave __s _st sta tar art rte ted __w _wi wit ith __a _an __s __b _bu but __i __c _co cou oul uld __b _be __t _to tot ota tal all lly __o _of off __o _on __t _th tha hat",0.05882353,0.0,0.0,0.0,0.0,0.0,0.0,0.0,0.04411765,0.014705882,0.0,0.0,0.014705882,0.04411765,0.029411765,0.029411765,0.029411765,0.0,0.0,0.073529415,0.0,0.0882353,0.0,0.0,0.073529415,0.014705882,0.20588236,0.04411765,0.073529415,0.0,0.014705882,0.029411765,0.073529415,0.0,0.0,0.0,0.0,0.0,0.073529415,0.073529415,0.014705882,0.5441176,0.0,0.0,0.014705882,0.014705882,0.0,0.0,0.05882353,0.04411765,0.0882353,0.0,0.05882353,0.014705882,0.04411765,0.0,0.0,0.0,0.0,0.0,0.0,0.029411765,0.029411765,0.073529415,0.16176471,0.16176471,0.014705882,0.14705883,0.029411765,0.0,0.0,0.0,0.0,0.0,0.04411765,0.13235295,0.05882353,0.0,0.029411765,0.0,0.04411765,0.19117647,0.0,0.014705882,0.014705882,1
9cke4z,what would be the features u would add to tw to make it better?,1.0,1.0,63.0,totalwar,"i love tw attila and the mod support on steam makes it even greater  but i wish there would be something like a custom campaign where u can choose where every faction starts or something like a ""create custom faction"" to make a personal way of history what would u people add let me know in the comments  ",73.0,106.0,1.0,2018-09-03 13:30:02,ArchACatto,0.0,0.0,14.0,309.0,58.0,46,"__i __l _lo lov ove __t _tw __a _at att tti til ila __a _an and __t _th the __m _mo mod __s _su sup upp ppo por ort __o _on __s _st ste tea eam __m _ma mak ake kes __i _it __e _ev eve ven __g _gr gre rea eat ate ter er. __b _bu but __i __w _wi wis ish __t _th the her ere __w _wo wou oul uld __b _be __s _so som ome met eth thi hin ing __l _li lik ike __a __c _cu cus ust sto tom __c _ca cam amp mpa pai aig ign __w _wh whe her ere __u __c _ca can __c _ch cho hoo oos ose __w _wh whe her ere __e _ev eve ver ery __f _fa fac act cti tio ion __s _st sta tar art rts __o _or __s _so som ome met eth thi hin ing __l _li lik ike __a __"" _""c ""cr cre rea eat ate __c _cu cus ust sto tom __f _fa fac act cti tio ion on"" __t _to __m _ma mak ake __a __p _pe per ers rso son ona nal __w _wa way __o _of __h _hi his ist sto tor ory ry. y.w .wh wha hat __w _wo wou oul uld __u __p _pe peo eop opl ple __a _ad add dd? d?l ?le let __m _me __k _kn kno now __i _in __t _th the __c _co com omm mme men ent nts ts!",0.1754386,0.0,0.0025062656,0.07017544,0.0,0.0,0.01754386,0.010025063,0.05764411,0.0025062656,0.0050125313,0.010025063,0.012531328000000001,0.04010025,0.0802005,0.0726817,0.01754386,0.015037594,0.01754386,0.06265664,0.0025062656,0.0877193,0.030075189,0.007518797,0.01754386,0.010025063,0.17042607,0.027568921,0.09273182599999999,0.0,0.050125312000000005,0.02255639,0.055137843,0.0,0.015037594,0.0,0.0,0.0050125313,0.042606517999999996,0.13283208,0.0,0.59398496,0.020050125,0.0,0.0025062656,0.110275686,0.012531328000000001,0.0025062656,0.06015037700000001,0.01754386,0.05764411,0.0025062656,0.0,0.0,0.012531328000000001,0.030075189,0.050125312000000005,0.0,0.0025062656,0.010025063,0.020050125,0.02255639,0.020050125,0.12531328,0.14285715,0.18546365,0.03508772,0.12280702,0.0,0.0050125313,0.007518797,0.007518797,0.0025062656,0.0,0.0,0.07769424,0.06265664,0.007518797,0.030075189,0.0025062656,0.05263158,0.1829574,0.0,0.01754386,0.012531328000000001,1
8n1dhz,did google ever give us any sort of explanation for why they made the ability to reply to comments of comments non-functional?,4.0,3.0,126.0,youtube,i know its been a while now  but it still pisses me off  it used to be that if you read a comment thread and wanted to reply to what somebody wrote in there  you could reply to just that comment specifically  and there would be a new sub thread created just for your particular response  and in case of multiple replies  every reply has a tag with the persons name to whom  theyre talking to  its there for everybody to see  everybody knows who which comment youre replying to now if you want to reply to a person it just tacks your message onto the bottom of the thread with zero context  no indication whatsoever who or what youre replying to specifically  its just lost and meaningless  the person youre replying to wont even know a lot of the time because everybody who replied previously gets a friggin notification too its just hard for me to wrap my head around what they did  it was completely functional previously  why would they intentionally remove a feature that promotes actual engaging discussions rather than mindless blathering  even though that was about 90  of youtube comments anyway ,11044.0,6833.0,0.83,2018-05-29 21:22:40,Regnes,0.0,0.0,22.0,1119.0,194.0,120,"__i __k _kn kno now __i _it its __b _be bee een __a __w _wh whi hil ile __n _no now ow, __b _bu but __i _it __s _st sti til ill __p _pi pis iss sse ses __m _me __o _of off ff. __i _it __u _us use sed __t _to __b _be __t _th tha hat __i _if __y _yo you __r _re rea ead __a __c _co com omm mme men ent __t _th thr hre rea ead __a _an and __w _wa wan ant nte ted __t _to __r _re rep epl ply __t _to __w _wh wha hat __s _so som ome meb ebo bod ody __w _wr wro rot ote __i _in __t _th the her ere re, __y _yo you __c _co cou oul uld __r _re rep epl ply __t _to __j _ju jus ust __t _th tha hat __c _co com omm mme men ent __s _sp spe pec eci cif ifi fic ica cal all lly ly, __a _an and __t _th the her ere __w _wo wou oul uld __b _be __a __n _ne new __s _su sub ub- b-t -th thr hre rea ead __c _cr cre rea eat ate ted __j _ju jus ust __f _fo for __y _yo you our __p _pa par art rti tic icu cul ula lar __r _re res esp spo pon ons nse se, __a _an and __i _in __c _ca cas ase __o _of __m _mu mul ult lti tip ipl ple __r _re rep epl pli lie ies es, __e _ev eve ver ery __r _re rep epl ply __h _ha has __a __t _ta tag __w _wi wit ith __t _th the __p _pe per ers rso son ons __n _na nam ame __t _to __w _wh who hom __t _th the hey eyr yre __t _ta tal alk lki kin ing __t _to to. __i _it its __t _th the her ere __f _fo for __e _ev eve ver ery ryb ybo bod ody __t _to __s _se see ee, __e _ev eve ver ery ryb ybo bod ody __k _kn kno now ows __w _wh who __w _wh whi hic ich __c _co com omm mme men ent __y _yo you our ure __r _re rep epl ply lyi yin ing __t _to to. o.n .no now __i _if __y _yo you __w _wa wan ant __t _to __r _re rep epl ply __t _to __a __p _pe per ers rso son __i _it __j _ju jus ust __t _ta tac ack cks __y _yo you our __m _me mes ess ssa sag age __o _on ont nto __t _th the __b _bo bot ott tto tom __o _of __t _th the __t _th thr hre rea ead __w _wi wit ith __z _ze zer ero __c _co con ont nte tex ext xt. __n _no __i _in ind ndi dic ica cat ati tio ion __w _wh wha hat ats tso soe oev eve ver __w _wh who __o _or __w _wh wha hat __y _yo you our ure __r _re rep epl ply lyi yin ing __t _to __s _sp spe pec eci cif ifi fic ica cal all lly ly, __i _it its __j _ju jus ust __l _lo los ost __a _an and __m _me mea ean ani nin ing ngl gle les ess ss. __t _th the __p _pe per ers rso son __y _yo you our ure __r _re rep epl ply lyi yin ing __t _to __w _wo won ont __e _ev eve ven __k _kn kno now __a __l _lo lot __o _of __t _th the __t _ti tim ime __b _be bec eca cau aus use __e _ev eve ver ery ryb ybo bod ody __w _wh who __r _re rep epl pli lie ied __p _pr pre rev evi vio iou ous usl sly __g _ge get ets __a __f _fr fri rig igg ggi gin __n _no not oti tif ifi fic ica cat ati tio ion __t _to too oo. o.i .it its __j _ju jus ust __h _ha har ard __f _fo for __m _me __t _to __w _wr wra rap __m _my __h _he hea ead __a _ar aro rou oun und __w _wh wha hat __t _th the hey __d _di did id. __i _it __w _wa was __c _co com omp mpl ple let ete tel ely __f _fu fun unc nct cti tio ion ona nal __p _pr pre rev evi vio iou ous usl sly ly. __w _wh why __w _wo wou oul uld __t _th the hey __i _in int nte ten ent nti tio ion ona nal all lly __r _re rem emo mov ove __a __f _fe fea eat atu tur ure __t _th tha hat __p _pr pro rom omo mot ote tes __a _ac act ctu tua ual __e _en eng nga gag agi gin ing __d _di dis isc scu cus uss ssi sio ion ons __r _ra rat ath the her __t _th tha han __m _mi min ind ndl dle les ess __b _bl bla lat ath the her eri rin ing __( _(e (ev eve ven __t _th tho hou oug ugh __t _th tha hat __w _wa was __a _ab abo bou out __9 _90 90% __o _of __y _yo you out utu tub ube __c _co com omm mme men ent nts __a _an any nyw ywa way ay)",0.0,0.0,0.0,0.0,0.0,0.0,0.0,0.0,0.0,0.0,0.0,0.0,0.0,0.0,0.0,0.0,0.0,0.0,0.0,0.0,0.0,0.0,0.0,0.0,0.0,0.0,0.0,0.0,0.0,0.0,0.0,0.0,0.0,0.0,0.0,0.0,0.0,0.0,0.0,0.0,0.0,0.0,0.0,0.0,0.0,0.0,0.0,0.0,0.0,0.0,0.0,0.0,0.0,0.0,0.0,0.0,0.0,0.0,0.0,0.0,0.0,0.0,0.0,0.0,0.0,0.0,0.0,0.0,0.0,0.0,0.0,0.0,0.0,0.0,0.0,0.0,0.0,0.0,0.0,0.0,0.0,0.0,0.0,0.0,0.0,1
9o7bjw,[tomt][song] help finding a song from an anime?,2.0,2.0,47.0,tipofmytongue,"im looking for a prominent  recurring background track that plays during the anime school rumble  definitely during the first few episodes  possibly throughout the series  it has a very slow  but bouncy mood to it  usually played during silly moments or casual moments  it has a very similar melody to the title line in ""tell me something good"" by rufus   chaka khan  but i have no idea what the title is  and cant seem to find it on youtube ",5924.0,1844.0,1.0,2018-10-15 02:08:59,j_abbs,0.0,0.0,8.0,444.0,80.0,64,"__i _im __l _lo loo ook oki kin ing __f _fo for __a __p _pr pro rom omi min ine nen ent nt, __r _re rec ecu cur urr rri rin ing __b _ba bac ack ckg kgr gro rou oun und __t _tr tra rac ack __t _th tha hat __p _pl pla lay ays __d _du dur uri rin ing __t _th the __a _an ani nim ime __s _sc sch cho hoo ool __r _ru rum umb mbl ble le, __d _de def efi fin ini nit ite tel ely __d _du dur uri rin ing __t _th the __f _fi fir irs rst __f _fe few __e _ep epi pis iso sod ode des es, __p _po pos oss ssi sib ibl bly __t _th thr hro rou oug ugh gho hou out __t _th the __s _se ser eri rie ies es. __i _it __h _ha has __a __v _ve ver ery __s _sl slo low ow, __b _bu but __b _bo bou oun unc ncy __m _mo moo ood __t _to __i _it it, __u _us usu sua ual all lly __p _pl pla lay aye yed __d _du dur uri rin ing __s _si sil ill lly __m _mo mom ome men ent nts __o _or __c _ca cas asu sua ual __m _mo mom ome men ent nts ts. __i _it __h _ha has __a __v _ve ver ery __s _si sim imi mil ila lar __m _me mel elo lod ody __t _to __t _th the __t _ti tit itl tle __l _li lin ine __i _in __"" _""t ""te tel ell __m _me __s _so som ome met eth thi hin ing __g _go goo ood od"" __b _by __r _ru ruf ufu fus __& __c _ch cha hak aka __k _kh kha han an, __b _bu but __i __h _ha hav ave __n _no __i _id ide dea __w _wh wha hat __t _th the __t _ti tit itl tle __i _is is, __a _an and __c _ca can ant __s _se see eem __t _to __f _fi fin ind __i _it __o _on __y _yo you out utu tub ube be.",0.16853933,0.0,0.0,0.04868914,0.0,0.018726591,0.029962547000000006,0.0,0.07116105,0.0,0.0,0.0,0.033707865,0.052434456,0.026217228,0.037453182,0.011235955,0.0,0.0,0.086142324,0.0037453184,0.09363296,0.0,0.0,0.037453182,0.014981274,0.123595506,0.033707865,0.04494382,0.0,0.026217228,0.014981274,0.06741573,0.0,0.0037453184,0.0,0.0,0.02247191,0.007490637,0.13483146,0.0,0.46441948,0.0,0.0,0.0037453184,0.0037453184,0.0037453184,0.0,0.037453182,0.007490637,0.04868914,0.0,0.0,0.033707865,0.011235955,0.0,0.007490637,0.0,0.0,0.041198503,0.0037453184,0.029962547000000006,0.011235955,0.029962547000000006,0.16479401,0.07865169,0.02247191,0.10861423,0.0,0.018726591,0.0037453184,0.0037453184,0.0,0.0,0.0,0.052434456,0.04868914,0.0,0.033707865,0.0037453184,0.04494382,0.15355805,0.007490637,0.037453182,0.014981274,1
6nygao,[spoiler] why doesn't curie's voice change?,9.0,12.0,43.0,fo4,when curie becomes a synth in the emergent behavior quest  she is moving from one set of hardware to another  i get that it would be dumb to have to hire two voice actresses for the same character  but is there any lore ingame reason for her voice to stay the same ,1046.0,886.0,0.85,2017-07-17 21:15:52,TheSandwichMeat,0.0,0.0,6.0,265.0,51.0,43,"__w _wh whe hen __c _cu cur uri rie __b _be bec eco com ome mes __a __s _sy syn ynt nth __i _in __t _th the __e _em eme mer erg rge gen ent __b _be beh eha hav avi vio ior __q _qu que ues est st, __s _sh she __i _is __m _mo mov ovi vin ing __f _fr fro rom __o _on one __s _se set __o _of __h _ha har ard rdw dwa war are __t _to __a _an ano not oth the her er. __i __g _ge get __t _th tha hat __i _it __w _wo wou oul uld __b _be __d _du dum umb __t _to __h _ha hav ave __t _to __h _hi hir ire __t _tw two __v _vo voi oic ice __a _ac act ctr tre res ess sse ses __f _fo for __t _th the __s _sa sam ame __c _ch cha har ara rac act cte ter er, __b _bu but __i _is __t _th the her ere __a _an any __l _lo lor ore re/ e/i /in ing nga gam ame __r _re rea eas aso son __f _fo for __h _he her __v _vo voi oic ice __t _to __s _st sta tay __t _th the __s _sa sam ame me?",0.18584071,0.0,0.0,0.026548672,0.0,0.03539823,0.0088495575,0.017699115,0.06194690200000001,0.0,0.03539823,0.0,0.07079646,0.053097345,0.06194690200000001,0.10619469,0.044247787,0.0088495575,0.0,0.03539823,0.0,0.097345136,0.017699115,0.0,0.017699115,0.0,0.15929204,0.03539823,0.07079646,0.0,0.097345136,0.0088495575,0.15044248,0.0,0.0,0.0,0.0,0.0,0.026548672,0.13274336,0.0088495575,0.54867256,0.017699115,0.0,0.0,0.10619469,0.0,0.0,0.017699115,0.017699115,0.07964602,0.026548672,0.0,0.0,0.0,0.017699115,0.026548672,0.0,0.0,0.0088495575,0.0,0.07079646,0.044247787,0.10619469,0.11504425,0.18584071,0.0088495575,0.07964602,0.0,0.03539823,0.0,0.0,0.0,0.0,0.0,0.097345136,0.03539823,0.0,0.044247787,0.0,0.044247787,0.15044248,0.0,0.044247787,0.0,1
aj017u,what heroes do you play with pleb (default) skins?,37.0,122.0,50.0,heroesofthestorm,i play tychus  medivh  maiev  and johanna with their default skins  with tints    sometimes i will break out speedo tychus for lulz if im feeling it but otherwise i just prefer his normal aesthetic of being a power armored space marine with a giant gun  but big rig tychus is over the top    infested skin is great  but too icky for me  just not my style   same with jo   i played a ton of crusader in d3 and i just prefer her looking like the knight in armor  no frills   i like maiev looking like her default wc3 appearance  which isnt an option yet since in wc3 her armor was slightly different and you could see her face  which i miss   if  however  they ever release the lifeguard johanna skin they teased with that summer event spray    that would probably change my mind   just sayin,23421.0,6197.0,0.84,2019-01-23 16:07:44,DarkRaven01,0.0,0.0,9.0,797.0,144.0,104,"__i __p _pl pla lay __t _ty tyc ych chu hus us, __m _me med edi div ivh vh, __m _ma mai aie iev ev, __a _an and __j _jo joh oha han ann nna __w _wi wit ith __t _th the hei eir __d _de def efa fau aul ult __s _sk ski kin ins __( _(w (wi wit ith __t _ti tin int nts ts) s). __s _so som ome met eti tim ime mes __i __w _wi wil ill __b _br bre rea eak __o _ou out __s _sp spe pee eed edo __t _ty tyc ych chu hus __f _fo for __l _lu lul ulz __i _if __i _im __f _fe fee eel eli lin ing __i _it __b _bu but __o _ot oth the her erw rwi wis ise __i __j _ju jus ust __p _pr pre ref efe fer __h _hi his __n _no nor orm rma mal __a _ae aes est sth the het eti tic __o _of __b _be bei ein ing __a __p _po pow owe wer er- r-a -ar arm rmo mor ore red __s _sp spa pac ace __m _ma mar ari rin ine __w _wi wit ith __a __g _gi gia ian ant __g _gu gun __( _(b (bu but __b _bi big __r _ri rig __t _ty tyc ych chu hus __i _is __o _ov ove ver __t _th the __t _to top op) p). __i _in inf nfe fes est ste ted __s _sk ski kin __i _is __g _gr gre rea eat at, __b _bu but __t _to too __i _ic ick cky __f _fo for __m _me me, __j _ju jus ust __n _no not __m _my __s _st sty tyl yle le. __s _sa sam ame __w _wi wit ith __j _jo jo. __i __p _pl pla lay aye yed __a __t _to ton __o _of __c _cr cru rus usa sad ade der __i _in __d _d3 __a _an and __i __j _ju jus ust __p _pr pre ref efe fer __h _he her __l _lo loo ook oki kin ing __l _li lik ike __t _th the __k _kn kni nig igh ght __i _in __a _ar arm rmo mor or, __n _no __f _fr fri ril ill lls ls. __i __l _li lik ike __m _ma mai aie iev __l _lo loo ook oki kin ing __l _li lik ike __h _he her __d _de def efa fau aul ult __w _wc wc3 __a _ap app ppe pea ear ara ran anc nce ce, __w _wh whi hic ich __i _is isn snt __a _an __o _op opt pti tio ion __y _ye yet __s _si sin inc nce __i _in __w _wc wc3 __h _he her __a _ar arm rmo mor __w _wa was __s _sl sli lig igh ght htl tly __d _di dif iff ffe fer ere ren ent __a _an and __y _yo you __c _co cou oul uld __s _se see __h _he her __f _fa fac ace ce, __w _wh whi hic ich __i __m _mi mis iss ss. __i _if if, __h _ho how owe wev eve ver er, __t _th the hey __e _ev eve ver __r _re rel ele lea eas ase __t _th the __l _li lif ife feg egu gua uar ard __j _jo joh oha han ann nna __s _sk ski kin __t _th the hey __t _te tea eas ase sed __w _wi wit ith __t _th tha hat __s _su sum umm mme mer __e _ev eve ven ent __s _sp spr pra ray ay. y.. ... __t _th tha hat __w _wo wou oul uld __p _pr pro rob oba bab abl bly __c _ch cha han ang nge __m _my __m _mi min ind nd. __j _ju jus ust __s _sa say ayi yin",0.10526316,0.0,0.0,0.0,0.0,0.0,0.0,0.0,0.05263158,0.05263158,0.0,0.0,0.0,0.0,0.05263158,0.02631579,0.02631579,0.0,0.0,0.05263158,0.0,0.10526316,0.02631579,0.0,0.05263158,0.0,0.2631579,0.0,0.10526316,0.0,0.078947365,0.02631579,0.10526316,0.0,0.0,0.0,0.0,0.0,0.05263158,0.15789473,0.0,0.5,0.0,0.0,0.0,0.02631579,0.0,0.0,0.02631579,0.02631579,0.10526316,0.0,0.02631579,0.0,0.0,0.02631579,0.0,0.0,0.0,0.02631579,0.0,0.02631579,0.05263158,0.05263158,0.10526316,0.15789473,0.02631579,0.10526316,0.0,0.02631579,0.0,0.0,0.0,0.0,0.02631579,0.078947365,0.10526316,0.0,0.10526316,0.0,0.0,0.23684211,0.0,0.05263158,0.0,1
8mwv9r,qol: artanis' ults should not dismount him,0.0,5.0,42.0,heroesofthestorm,"i find it rather annoying that casting artanis ults dismounts him  considering they are not just global but ""remote""   hes literally just calling in an airstrike from a giant orbiting mothership   i would think he could do that without getting down from his horse  if not  get the man a hands free phone   its not like hes psychic and can just transmit his thoughts or anything   seriously though  i often seem to find myself casting my ult while returning from spawn or rotating from the solo lane and its a really annoying delay ",23421.0,6197.0,0.45,2018-05-29 09:18:08,DarkRaven01,0.0,0.0,7.0,538.0,93.0,72,"__i __f _fi fin ind __i _it __r _ra rat ath the her __a _an ann nno noy oyi yin ing __t _th tha hat __c _ca cas ast sti tin ing __a _ar art rta tan ani nis __u _ul ult lts __d _di dis ism smo mou oun unt nts __h _hi him im, __c _co con ons nsi sid ide der eri rin ing __t _th the hey __a _ar are __n _no not __j _ju jus ust __g _gl glo lob oba bal __b _bu but __"" _""r ""re rem emo mot ote te"" __- __h _he hes __l _li lit ite ter era ral all lly __j _ju jus ust __c _ca cal all lli lin ing __i _in __a _an __a _ai air irs rst str tri rik ike __f _fr fro rom __a __g _gi gia ian ant __o _or orb rbi bit iti tin ing __m _mo mot oth the her ers rsh shi hip ip. __i __w _wo wou oul uld __t _th thi hin ink __h _he __c _co cou oul uld __d _do __t _th tha hat __w _wi wit ith tho hou out __g _ge get ett tti tin ing __d _do dow own __f _fr fro rom __h _hi his __h _ho hor ors rse se; __i _if __n _no not ot, __g _ge get __t _th the __m _ma man __a __h _ha han and nds ds- s-f -fr fre ree __p _ph pho hon one ne! __i _it its __n _no not __l _li lik ike __h _he hes __p _ps psy syc ych chi hic __a _an and __c _ca can __j _ju jus ust __t _tr tra ran ans nsm smi mit __h _hi his __t _th tho hou oug ugh ght hts __o _or __a _an any nyt yth thi hin ing ng. g.. ... ..s .se ser eri rio iou ous usl sly __t _th tho hou oug ugh gh, __i __o _of oft fte ten __s _se see eem __t _to __f _fi fin ind __m _my mys yse sel elf __c _ca cas ast sti tin ing __m _my __u _ul ult __w _wh whi hil ile __r _re ret etu tur urn rni nin ing __f _fr fro rom __s _sp spa paw awn __o _or __r _ro rot ota tat ati tin ing __f _fr fro rom __t _th the __s _so sol olo __l _la lan ane __a _an and __i _it its __a __r _re rea eal all lly __a _an ann nno noy oyi yin ing __d _de del ela lay ay.",0.14,0.02,0.0,0.0,0.0,0.0,0.0,0.0,0.08,0.04,0.0,0.0,0.02,0.0,0.04,0.04,0.02,0.0,0.0,0.06,0.0,0.12,0.08,0.06,0.0,0.0,0.16,0.0,0.06,0.08,0.06,0.0,0.04,0.0,0.0,0.0,0.0,0.04,0.08,0.04,0.0,0.48,0.0,0.0,0.0,0.0,0.02,0.0,0.04,0.0,0.02,0.0,0.0,0.02,0.02,0.02,0.0,0.0,0.02,0.0,0.0,0.04,0.0,0.02,0.16,0.04,0.06,0.08,0.0,0.0,0.0,0.0,0.0,0.0,0.0,0.1,0.06,0.0,0.08,0.0,0.0,0.14,0.0,0.1,0.02,1
