submission_id,title,score,num_comments,title_length,subreddit,post_text,comment_karma,link_karma,upvote_ratio,date_created,user_name,appearance,text_changed,num_words_title,post_length,num_words_post,num_distinct_words,trigrams,AllPunc,Apostro,Colon,Comma,Dash,Exclam,OtherP,Parenth,Period,QMark,Quote,SemiC,achieve,adj,adverb,affect,affiliation,anger,anx,article,assent,auxverb,bio,body,cause,certain,cogproc,compare,conj,death,differ,discrep,drives,family,feel,female,filler,focusfuture,focuspast,focuspresent,friend,function,health,hear,home,i,informal,ingest,insight,interrog,ipron,leisure,male,money,motion,negate,negemo,netspeak,nonflu,number,percept,posemo,power,ppron,prep,pronoun,quant,relativ,relig,reward,risk,sad,see,sexual,shehe,social,space,swear,tentat,they,time,verb,we,work,you,is_depressed
8udamh,"[req] ($500 + $100 interest) - (#ames, ia, usa), (august), (cashapp, venmo, google wallet, messenger)",1.0,3.0,101.0,borrow,it has been a slow summer as a server  and between a few emergency finances these past few months  i am behind on money for bills  and wont have enough for rent on the first  i do not have a paypal set up so it will take 21 days for it to be able to be used  which i would prefer to not have to do that since it would be extremely late  i have had this reddit account for almost 6 years  am active  and while i do not have a loaning history on here i am hoping that will change  i am a college student  with a job  but i receive a large scholarship payout at the beginning of each semester at dispersement time  and will be receiving about  8 000 in august so you will be getting paid back the  500 with  100 interest the day my dispersement comes in  or i can do weekly payments of  100 starting the last few weeks of july if you would prefer that i am willing to produce information required for a loan i appreciate you taking the time to read this  and i look forward to hearing from someone soon ,6148.0,4460.0,0.67,2018-06-27 23:57:22,skaboosh,0.0,0.0,15.0,1007.0,200.0,122,"__i _it __h _ha has __b _be bee een __a __s _sl slo low __s _su sum umm mme mer __a _as __a __s _se ser erv rve ver er, __a _an and __b _be bet etw twe wee een __a __f _fe few __e _em eme mer erg rge gen enc ncy __f _fi fin ina nan anc nce ces __t _th the hes ese __p _pa pas ast __f _fe few __m _mo mon ont nth ths hs, __i __a _am __b _be beh ehi hin ind __o _on __m _mo mon one ney __f _fo for __b _bi bil ill lls ls, __a _an and __w _wo won ont __h _ha hav ave __e _en eno nou oug ugh __f _fo for __r _re ren ent __o _on __t _th the __f _fi fir irs rst st. __i __d _do __n _no not __h _ha hav ave __a __p _pa pay ayp ypa pal __s _se set __u _up __s _so __i _it __w _wi wil ill __t _ta tak ake __2 _21 __d _da day ays __f _fo for __i _it __t _to __b _be __a _ab abl ble __t _to __b _be __u _us use sed ed, __w _wh whi hic ich __i __w _wo wou oul uld __p _pr pre ref efe fer __t _to __n _no not __h _ha hav ave __t _to __d _do __t _th tha hat __s _si sin inc nce __i _it __w _wo wou oul uld __b _be __e _ex ext xtr tre rem eme mel ely __l _la lat ate te. __i __h _ha hav ave __h _ha had __t _th thi his __r _re red edd ddi dit __a _ac acc cco cou oun unt __f _fo for __a _al alm lmo mos ost __6 __y _ye yea ear ars rs, __a _am __a _ac act cti tiv ive ve, __a _an and __w _wh whi hil ile __i __d _do __n _no not __h _ha hav ave __a __l _lo loa oan ani nin ing __h _hi his ist sto tor ory __o _on __h _he her ere __i __a _am __h _ho hop opi pin ing __t _th tha hat __w _wi wil ill __c _ch cha han ang nge ge. __i __a _am __a __c _co col oll lle leg ege __s _st stu tud ude den ent nt, __w _wi wit ith __a __j _jo job ob, __b _bu but __i __r _re rec ece cei eiv ive __a __l _la lar arg rge __s _sc sch cho hol ola lar ars rsh shi hip __p _pa pay ayo you out __a _at __t _th the __b _be beg egi gin inn nni nin ing __o _of __e _ea eac ach __s _se sem eme mes est ste ter __a _at __d _di dis isp spe per ers rse sem eme men ent __t _ti tim ime me, __a _an and __w _wi wil ill __b _be __r _re rec ece cei eiv ivi vin ing __a _ab abo bou out __$ _$8 $8, 8,0 ,00 000 __i _in __a _au aug ugu gus ust __s _so __y _yo you __w _wi wil ill __b _be __g _ge get ett tti tin ing __p _pa pai aid __b _ba bac ack __t _th the __$ _$5 $50 500 __w _wi wit ith __$ _$1 $10 100 __i _in int nte ter ere res est __t _th the __d _da day __m _my __d _di dis isp spe per ers rse sem eme men ent __c _co com ome mes __i _in in. __o _or __i __c _ca can __d _do __w _we wee eek ekl kly __p _pa pay aym yme men ent nts __o _of __$ _$1 $10 100 __s _st sta tar art rti tin ing __t _th the __l _la las ast __f _fe few __w _we wee eek eks __o _of __j _ju jul uly __i _if __y _yo you __w _wo wou oul uld __p _pr pre ref efe fer __t _th tha hat at. t.i __a _am __w _wi wil ill lli lin ing __t _to __p _pr pro rod odu duc uce __i _in inf nfo for orm rma mat ati tio ion __r _re req equ qui uir ire red __f _fo for __a __l _lo loa oan an. n.i __a _ap app ppr pre rec eci cia iat ate __y _yo you __t _ta tak aki kin ing __t _th the __t _ti tim ime __t _to __r _re rea ead __t _th thi his is, __a _an and __i __l _lo loo ook __f _fo for orw rwa war ard __t _to __h _he hea ear ari rin ing __f _fr fro rom __s _so som ome meo eon one __s _so soo oon on.",0.10294118,0.031862747000000004,0.0,0.012254902,0.0,0.0,0.0,0.004901961,0.05392157,0.0,0.0,0.0,0.041666668,0.041666668,0.06372549400000001,0.068627454,0.009803922,0.0024509805,0.007352941,0.06127451,0.0,0.075980395,0.004901961,0.0024509805,0.012254902,0.017156863999999997,0.13235295,0.041666668,0.073529415,0.0,0.04656863,0.009803922,0.11029412,0.004901961,0.019607844,0.0,0.0,0.012254902,0.071078435,0.0882353,0.0024509805,0.5808824,0.0024509805,0.0024509805,0.004901961,0.10539216,0.009803922,0.0,0.034313727,0.004901961,0.068627454,0.0024509805,0.012254902,0.0,0.014705882,0.017156863999999997,0.024509804,0.007352941,0.0,0.034313727,0.024509804,0.04411765,0.034313727,0.14215687,0.13970588,0.21078432,0.012254902,0.125,0.0,0.05392157,0.004901961,0.009803922,0.0024509805,0.0,0.009803922,0.06372549400000001,0.041666668,0.0024509805,0.019607844,0.004901961,0.068627454,0.18382353,0.0,0.066176474,0.022058824,1
80q0ss,a dm-ing first for me: reskinned monsters,29.0,6.0,41.0,DnD,"so  the first adventure of my new campaign emerged when i somehow misread the stat block for sea spawn as cr 1 8 instead of cr 1 and decided that sending my players to   innsmouth   a tiny fishing village with a reputation for eldritch weirdness infested by the things would be a good idea in a panic  partly because i realized my error  and partly because one player couldnt make it  so the boss i was planning was going to be way too tough  i started grabbing any old low cr monster i could find to populate the dungeon the one encounter we got to involved creatures i had vaguely labeled as ""1d4 eldritch horrors  reskinned mud mephits  incubating in adventurer corpses  explode out and attack when touched "" they were a blast  and grossed the living hell out of my players i scrambled to figure out what these things looked like  and eventually pulled a rejected thumbnail from when i was drawing an eldritch horror for myself  six stubby little insectoid legs  a big central eye  and a carapace with sockets in the top from which big slimy tentacles emerge  the mephits fist attack became a tentacle attack  its mud breath became a tentacle based grab  and when they died  their carapace shattered revealing dozens of smaller tentacles making a desperate grab at anyone around them in place of the mud mephits death burst so  the one combat that took place so far grossed my players out to the extreme and taught me how powerful this little dm ing tool can truly be  10 10  would reskin again \  pun not noticed until  way  after i wrote this sentence ",25042.0,1523.0,0.9,2018-02-27 22:56:01,unitedshoes,0.0,0.0,7.0,1571.0,274.0,181,"__s _so so, __t _th the __f _fi fir irs rst __a _ad adv dve ven ent ntu tur ure __o _of __m _my __n _ne new __c _ca cam amp mpa pai aig ign __e _em eme mer erg rge ged __w _wh whe hen __i __s _so som ome meh eho how __m _mi mis isr sre rea ead __t _th the __s _st sta tat __b _bl blo loc ock __f _fo for __s _se sea __s _sp spa paw awn __a _as __c _cr __1 _1/ 1/8 __i _in ins nst ste tea ead __o _of __c _cr __1 __a _an and __d _de dec eci cid ide ded __t _th tha hat __s _se sen end ndi din ing __m _my __p _pl pla lay aye yer ers __t _to __~ _~~ ~~i ~in inn nns nsm smo mou out uth th~ h~~ __a __t _ti tin iny __f _fi fis ish shi hin ing __v _vi vil ill lla lag age __w _wi wit ith __a __r _re rep epu put uta tat ati tio ion __f _fo for __e _el eld ldr dri rit itc tch __w _we wei eir ird rdn dne nes ess __i _in inf nfe fes est ste ted __b _by __t _th the __t _th thi hin ing ngs __w _wo wou oul uld __b _be __a __g _go goo ood __i _id ide dea ea. a.i .in __a __p _pa pan ani nic ic, __p _pa par art rtl tly __b _be bec eca cau aus use __i __r _re rea eal ali liz ize zed __m _my __e _er err rro ror or, __a _an and __p _pa par art rtl tly __b _be bec eca cau aus use __o _on one __p _pl pla lay aye yer __c _co cou oul uld ldn dnt __m _ma mak ake __i _it it, __s _so __t _th the __b _bo bos oss __i __w _wa was __p _pl pla lan ann nni nin ing __w _wa was __g _go goi oin ing __t _to __b _be __w _wa way __t _to too __t _to tou oug ugh gh, __i __s _st sta tar art rte ted __g _gr gra rab abb bbi bin ing __a _an any __o _ol old __l _lo low __c _cr cr- r-m -mo mon ons nst ste ter __i __c _co cou oul uld __f _fi fin ind __t _to __p _po pop opu pul ula lat ate __t _th the __d _du dun ung nge geo eon on. n.t .th the __o _on one __e _en enc nco cou oun unt nte ter __w _we __g _go got __t _to __i _in inv nvo vol olv lve ved __c _cr cre rea eat atu tur ure res __i __h _ha had __v _va vag agu gue uel ely __l _la lab abe bel ele led __a _as __"" _""1 ""1d 1d4 __e _el eld ldr dri rit itc tch __h _ho hor orr rro ror ors __( _(r (re res esk ski kin inn nne ned __m _mu mud __m _me mep eph phi hit its ts) __i _in inc ncu cub uba bat ati tin ing __i _in __a _ad adv dve ven ent ntu tur ure rer __c _co cor orp rps pse ses es; __e _ex exp xpl plo lod ode __o _ou out __a _an and __a _at att tta tac ack __w _wh whe hen __t _to tou ouc uch che hed ed. d."" __t _th the hey __w _we wer ere __a __b _bl bla las ast st* __a _an and __g _gr gro ros oss sse sed __t _th the __l _li liv ivi vin ing __h _he hel ell __o _ou out __o _of __m _my __p _pl pla lay aye yer ers rs. s.i __s _sc scr cra ram amb mbl ble led __t _to __f _fi fig igu gur ure __o _ou out __w _wh wha hat __t _th the hes ese __t _th thi hin ing ngs __l _lo loo ook oke ked __l _li lik ike ke, __a _an and __e _ev eve ven ent ntu tua ual all lly __p _pu pul ull lle led __a __r _re rej eje jec ect cte ted __t _th thu hum umb mbn bna nai ail __f _fr fro rom __w _wh whe hen __i __w _wa was __d _dr dra raw awi win ing __a _an __e _el eld ldr dri rit itc tch __h _ho hor orr rro ror __f _fo for __m _my mys yse sel elf lf: __s _si six __s _st stu tub ubb bby __l _li lit itt ttl tle __i _in ins nse sec ect cto toi oid __l _le leg egs gs, __a __b _bi big __c _ce cen ent ntr tra ral __e _ey eye ye, __a _an and __a __c _ca car ara rap apa pac ace __w _wi wit ith __s _so soc ock cke ket ets __i _in __t _th the __t _to top __f _fr fro rom __w _wh whi hic ich __b _bi big __s _sl sli lim imy __t _te ten ent nta tac acl cle les __e _em eme mer erg rge ge. __t _th the __m _me mep eph phi hit its __f _fi fis ist __a _at att tta tac ack __b _be bec eca cam ame __a __t _te ten ent nta tac acl cle __a _at att tta tac ack ck. __i _it its __m _mu mud __b _br bre rea eat ath __b _be bec eca cam ame __a __t _te ten ent nta tac acl cle le- e-b -ba bas ase sed __g _gr gra rab ab, __a _an and __w _wh whe hen __t _th the hey __d _di die ied ed, __t _th the hei eir __c _ca car ara rap apa pac ace __s _sh sha hat att tte ter ere red __r _re rev eve vea eal ali lin ing __d _do doz oze zen ens __o _of __s _sm sma mal all lle ler __t _te ten ent nta tac acl cle les __m _ma mak aki kin ing __a __d _de des esp spe per era rat ate __g _gr gra rab __a _at __a _an any nyo yon one __a _ar aro rou oun und __t _th the hem __i _in __p _pl pla lac ace __o _of __t _th the __m _mu mud __m _me mep eph phi hit its __d _de dea eat ath __b _bu bur urs rst st. t.s .so so, __t _th the __o _on one __c _co com omb mba bat __t _th tha hat __t _to too ook __p _pl pla lac ace __s _so __f _fa far __g _gr gro ros oss sse sed __m _my __p _pl pla lay aye yer ers __o _ou out __t _to __t _th the __e _ex ext xtr tre rem eme __a _an and __t _ta tau aug ugh ght __m _me __h _ho how __p _po pow owe wer erf rfu ful __t _th thi his __l _li lit itt ttl tle __d _dm dm- m-i -in ing __t _to too ool __c _ca can __t _tr tru rul uly __b _be be. __1 _10 10/ 0/1 /10 10, __w _wo wou oul uld __r _re res esk ski kin __a _ag aga gai ain in. n.\ .\* __p _pu pun __n _no not __n _no not oti tic ice ced __u _un unt nti til __* _*w *wa way ay* __a _af aft fte ter __i __w _wr wro rot ote __t _th thi his __s _se sen ent nte ten enc nce ce.",0.16273585,0.0,0.0,0.018867925,0.004716980999999999,0.0,0.094339624,0.014150944,0.030660378,0.0,0.0,0.0,0.016509434,0.04245283,0.054245282,0.047169812,0.014150944,0.0070754719999999985,0.0,0.04009434,0.0023584906,0.08490566,0.0023584906,0.0,0.028301887,0.016509434,0.13679245,0.035377357000000005,0.08726415,0.0,0.025943397000000003,0.023584906,0.06603774,0.004716980999999999,0.009433962,0.0,0.0,0.004716980999999999,0.028301887,0.11320755,0.004716980999999999,0.5259434000000001,0.0,0.004716980999999999,0.0,0.0754717,0.014150944,0.0023584906,0.028301887,0.009433962,0.051886793,0.0070754719999999985,0.0023584906,0.0023584906,0.009433962,0.0070754719999999985,0.014150944,0.0023584906,0.0070754719999999985,0.016509434,0.014150944,0.03301887,0.028301887,0.091981135,0.15330188,0.14386792,0.04245283,0.16037735,0.004716980999999999,0.0070754719999999985,0.004716980999999999,0.004716980999999999,0.0,0.0,0.0,0.054245282,0.07783019,0.0023584906,0.03301887,0.0070754719999999985,0.07311321,0.1485849,0.0,0.035377357000000005,0.009433962,1
7fo45t,the future of star wars games?,1.0,3.0,30.0,gaming,do we have any hope of any good star wars games coming out with ea in charge of all of them what are the odds any of them are actually any goodwe pretty much have no chance at a good single player game as all the money is in multiplayer it is just a very sad state of affairs ,13020.0,12571.0,0.57,2017-11-26 09:02:23,Unchainedboar,0.0,0.0,6.0,282.0,60.0,41,__d _do __w _we __h _ha hav ave __a _an any __h _ho hop ope __o _of __a _an any __g _go goo ood __s _st sta tar __w _wa war ars __g _ga gam ame mes __c _co com omi min ing __o _ou out ut? t?w ?wi wit ith __e _ea __i _in __c _ch cha har arg rge __o _of __a _al all __o _of __t _th the hem __w _wh wha hat __a _ar are __t _th the __o _od odd dds __a _an any __o _of __t _th the hem __a _ar are __a _ac act ctu tua ual all lly __a _an any __g _go goo ood odw dwe __p _pr pre ret ett tty __m _mu muc uch __h _ha hav ave __n _no __c _ch cha han anc nce __a _at __a __g _go goo ood __s _si sin ing ngl gle __p _pl pla lay aye yer __g _ga gam ame __a _as __a _al all __t _th the __m _mo mon one ney __i _is __i _in __m _mu mul ult lti tip ipl pla lay aye yer er. r.i .it __i _is __j _ju jus ust __a __v _ve ver ery __s _sa sad __s _st sta tat ate __o _of __a _af aff ffa fai air irs,0.13513513,0.0,0.0,0.054054055,0.0,0.0,0.0,0.0,0.08108108,0.0,0.0,0.0,0.08108108,0.027027028,0.08108108,0.027027028,0.0,0.0,0.0,0.10810811,0.0,0.10810811,0.0,0.0,0.0,0.0,0.21621622,0.027027028,0.027027028,0.0,0.10810811,0.027027028,0.10810811,0.0,0.0,0.0,0.0,0.0,0.054054055,0.16216215,0.0,0.5945946,0.0,0.0,0.0,0.054054055,0.027027028,0.0,0.054054055,0.0,0.10810811,0.0,0.0,0.0,0.0,0.08108108,0.0,0.027027028,0.0,0.027027028,0.0,0.027027028,0.0,0.054054055,0.13513513,0.16216215,0.027027028,0.1891892,0.0,0.0,0.027027028,0.0,0.0,0.0,0.0,0.0,0.08108108,0.0,0.027027028,0.0,0.10810811,0.1891892,0.0,0.08108108,0.0,1
7dfn74,what if the government has a deceased dna database,4.0,7.0,50.0,conspiracy,just a thought here but     what if once people die and go to the morgue  they take some hair or something for a dna sample  they could have a complete dna database of everyones recent ancestors  so say your mother is dead  so now say you commit a crime and leave some hair behind or something  if they test you in that database for your relatives they can identify your mother  all they have to do now is find out which of her children did it ,2611.0,1123.0,0.55,2017-11-16 23:22:08,TooAnonToQuit,0.0,0.0,9.0,446.0,86.0,61,"__j _ju jus ust __a __t _th tho hou oug ugh ght __h _he her ere __b _bu but ut. t.. ... ... __w _wh wha hat __i _if __o _on onc nce __p _pe peo eop opl ple __d _di die __a _an and __g _go __t _to __t _th the __m _mo mor org rgu gue ue, __t _th the hey __t _ta tak ake __s _so som ome __h _ha hai air __o _or __s _so som ome met eth thi hin ing __f _fo for __a __d _dn dna __s _sa sam amp mpl ple le. __t _th the hey __c _co cou oul uld __h _ha hav ave __a __c _co com omp mpl ple let ete __d _dn dna __d _da dat ata tab aba bas ase __o _of __e _ev eve ver ery ryo yon one nes __r _re rec ece cen ent __a _an anc nce ces est sto tor ors rs. __s _so __s _sa say __y _yo you our __m _mo mot oth the her __i _is __d _de dea ead ad. __s _so __n _no now __s _sa say __y _yo you __c _co com omm mmi mit __a __c _cr cri rim ime __a _an and __l _le lea eav ave __s _so som ome __h _ha hai air __b _be beh ehi hin ind __o _or __s _so som ome met eth thi hin ing ng. __i _if __t _th the hey __t _te tes est __y _yo you __i _in __t _th tha hat __d _da dat ata tab aba bas ase __f _fo for __y _yo you our __r _re rel ela lat ati tiv ive ves __t _th the hey __c _ca can __i _id ide den ent nti tif ify __y _yo you our __m _mo mot oth the her er. __a _al all __t _th the hey __h _ha hav ave __t _to __d _do __n _no now __i _is __f _fi fin ind __o _ou out __w _wh whi hic ich __o _of __h _he her __c _ch chi hil ild ldr dre ren __d _di did __i _it it.",0.33139536,0.0,0.0,0.040697675,0.029069768,0.011627907,0.07558139400000001,0.034883723,0.10465116,0.0,0.034883723,0.0,0.011627907,0.040697675,0.05813953700000001,0.05813953700000001,0.0058139535,0.0058139535,0.0,0.05813953700000001,0.0,0.0872093,0.023255814,0.0058139535,0.0058139535,0.011627907,0.11627907,0.0058139535,0.08139535,0.0,0.05232558,0.034883723,0.05232558,0.0,0.0,0.0,0.0,0.0,0.017441861,0.12209302,0.0,0.5232558,0.0,0.0,0.0,0.05813953700000001,0.023255814,0.011627907,0.0058139535,0.0058139535,0.023255814,0.0058139535,0.0,0.0,0.023255814,0.017441861,0.011627907,0.011627907,0.0058139535,0.0058139535,0.011627907,0.046511628,0.023255814,0.11046512,0.12790698,0.13372093,0.029069768,0.14534883,0.0058139535,0.011627907,0.0,0.0,0.011627907,0.0,0.0,0.10465116,0.06395349,0.0058139535,0.05232558,0.023255814,0.05813953700000001,0.16860466,0.0,0.040697675,0.029069768,1
9y3pzm,"looking for two certain games, old and browser based! a strange sort of trading card game and a combining game.",1.0,2.0,111.0,gamingsuggestions,i just remembered a couple of games from when i was a kid  i remembered the adults around me played this strange browser based sort of card game where you had these weird heroes that changed as you played  and it had a very early 2000s look to it  like they leveled up  and the art was sort of edgy and garbage pale kids ish  i dont really remember much on it besides that  the other one i remember a little better  it was a game where you had a bunch of different elements and you combined them and it made more elements  and you kept combining them and getting different things  ,8883.0,1825.0,0.66,2018-11-18 07:59:19,comfybluepants,0.0,0.0,20.0,585.0,112.0,74,"__i __j _ju jus ust __r _re rem eme mem emb mbe ber ere red __a __c _co cou oup upl ple __o _of __g _ga gam ame mes __f _fr fro rom __w _wh whe hen __i __w _wa was __a __k _ki kid id. __i __r _re rem eme mem emb mbe ber ere red __t _th the __a _ad adu dul ult lts __a _ar aro rou oun und __m _me __p _pl pla lay aye yed __t _th thi his __s _st str tra ran ang nge __b _br bro row ows wse ser __b _ba bas ase sed __s _so sor ort __o _of __c _ca car ard __g _ga gam ame __w _wh whe her ere __y _yo you __h _ha had __t _th the hes ese __w _we wei eir ird __h _he her ero roe oes __t _th tha hat __c _ch cha han ang nge ged __a _as __y _yo you __p _pl pla lay aye yed ed, __a _an and __i _it __h _ha had __a __v _ve ver ery __e _ea ear arl rly __2 _20 200 000 00s __l _lo loo ook __t _to __i _it it. __l _li lik ike __t _th the hey __l _le lev eve vel ele led __u _up up, __a _an and __t _th the __a _ar art __w _wa was __s _so sor ort __o _of __e _ed edg dgy __a _an and __g _ga gar arb rba bag age __p _pa pal ale __k _ki kid ids __i _is ish sh. __i __d _do don ont __r _re rea eal all lly __r _re rem eme mem emb mbe ber __m _mu muc uch __o _on __i _it __b _be bes esi sid ide des __t _th tha hat at. __t _th the __o _ot oth the her __o _on one __i __r _re rem eme mem emb mbe ber __a __l _li lit itt ttl tle __b _be bet ett tte ter er. __i _it __w _wa was __a __g _ga gam ame __w _wh whe her ere __y _yo you __h _ha had __a __b _bu bun unc nch __o _of __d _di dif iff ffe fer ere ren ent __e _el ele lem eme men ent nts __a _an and __y _yo you __c _co com omb mbi bin ine ned __t _th the hem __a _an and __i _it __m _ma mad ade __m _mo mor ore __e _el ele lem eme men ent nts ts, __a _an and __y _yo you __k _ke kep ept __c _co com omb mbi bin ini nin ing __t _th the hem __a _an and __g _ge get ett tti tin ing __d _di dif iff ffe fer ere ren ent __t _th thi hin ing ngs gs.",0.22881356,0.06497175,0.0028248588,0.03954802,0.0028248588,0.0,0.0056497175,0.0,0.10451978,0.008474576,0.0,0.0,0.014124294,0.050847456,0.08757062,0.07344632599999999,0.011299435,0.0056497175,0.0056497175,0.01977401,0.0,0.16101696,0.008474576,0.0056497175,0.01977401,0.02259887,0.20056497,0.036723163,0.06214689,0.0028248588,0.053672317,0.033898305,0.06497175,0.0,0.016949153,0.0,0.0028248588,0.033898305,0.016949153,0.19491525,0.0028248588,0.6158191999999999,0.0028248588,0.0056497175,0.0028248588,0.096045196,0.0028248588,0.0,0.04519774,0.01977401,0.06779661,0.0028248588,0.0056497175,0.0,0.014124294,0.04519774,0.042372882,0.0,0.0,0.016949153,0.036723163,0.031073445,0.025423728,0.11299435,0.1299435,0.18079096,0.025423728,0.11016949,0.0,0.01977401,0.0056497175,0.025423728,0.0056497175,0.0,0.0,0.04519774,0.050847456,0.0,0.050847456,0.0028248588,0.048022598,0.2457627,0.0056497175,0.008474576,0.008474576,1
